National Industry / Industrie nationale:,541190,Other legal services,Autres services juridiques,0,0,0,0,2,2,0,0,0,0,0,0,0,4
Industry Group / Groupe industriel:,5412,"Accounting, tax preparation, bookkeeping and payroll services","Services de comptabilité, de préparation de déclarations de revenus, de
tenue de livres et de paye",0,0,0,0,14,5,0,2,0,0,0,0,0,21
Industry / Industrie:,54121,"Accounting, tax preparation, bookkeeping and payroll services","Services de comptabilité, de préparation de déclarations de revenus, de
tenue de livres et de paye",0,0,0,0,14,5,0,2,0,0,0,0,0,21
National Industry / Industrie nationale:,541212,Offices of accountants,Cabinets de comptables,0,0,0,0,12,2,0,0,0,0,0,0,0,14
National Industry / Industrie nationale:,541213,Tax preparation services,Services de préparation des déclarations de revenus,0,0,0,0,0,0,0,2,0,0,0,0,0,2
National Industry / Industrie nationale:,541215,"Bookkeeping, payroll and related services",Services de tenue de livres et de paye et services connexes,0,0,0,0,2,3,0,0,0,0,0,0,0,5
Industry Group / Groupe industriel:,5413,"Architectural, engineering and related services","Architecture, génie et services connexes",0,0,0,0,19,11,0,0,4,2,0,0,0,36
Industry / Industrie:,54131,Architectural services,Services d'architecture,0,0,0,0,4,1,0,0,0,0,0,0,0,5
National Industry / Industrie nationale:,541310,Architectural services,Services d'architecture,0,0,0,0,4,1,0,0,0,0,0,0,0,5
Industry / Industrie:,54132,Landscape architectural services,Services d'architecture paysagère,0,0,0,0,1,1,0,0,1,2,0,0,0,5
National Industry / Industrie nationale:,541320,Landscape architectural services,Services d'architecture paysagère,0,0,0,0,1,1,0,0,1,2,0,0,0,5
Industry / Industrie:,54133,Engineering services,Services de génie,0,0,0,0,8,5,0,0,3,0,0,0,0,16
National Industry / Industrie nationale:,541330,Engineering services,Services de génie,0,0,0,0,8,5,0,0,3,0,0,0,0,16
Industry / Industrie:,54134,Drafting services,Services de dessin technique,0,0,0,0,0,0,0,0,0,0,0,0,0,0
National Industry / Industrie nationale:,541340,Drafting services,Services de dessin technique,0,0,0,0,0,0,0,0,0,0,0,0,0,0
Industry / Industrie:,54135,Building inspection services,Services d'inspection des bâtiments,0,0,0,0,6,2,0,0,0,0,0,0,0,8
National Industry / Industrie nationale:,541350,Building inspection services,Services d'inspection des bâtiments,0,0,0,0,6,2,0,0,0,0,0,0,0,8
Industry / Industrie:,54136,Geophysical surveying and mapping services,Services de prospection et de levé géophysiques,0,0,0,0,0,0,0,0,0,0,0,0,0,0
National Industry / Industrie nationale:,541360,Geophysical surveying and mapping services,Services de prospection et de levé géophysiques,0,0,0,0,0,0,0,0,0,0,0,0,0,0
Industry / Industrie:,54137,Surveying and mapping (except geophysical) services,Services d'arpentage et de cartographie (sauf les levés géophysiques),0,0,0,0,0,0,0,0,0,0,0,0,0,0
National Industry / Industrie nationale:,541370,Surveying and mapping (except geophysical) services,Services d'arpentage et de cartographie (sauf les levés géophysiques),0,0,0,0,0,0,0,0,0,0,0,0,0,0
Industry / Industrie:,54138,Testing laboratories,Laboratoires d'essai,0,0,0,0,0,2,0,0,0,0,0,0,0,2
National Industry / Industrie nationale:,541380,Testing laboratories,Laboratoires d'essai,0,0,0,0,0,2,0,0,0,0,0,0,0,2
Industry Group / Groupe industriel:,5414,Specialized design services,Services spécialisés de design,0,0,0,0,20,14,0,0,3,0,0,0,0,37
Industry / Industrie:,54141,Interior design services,Services de design d'intérieur,0,0,0,0,4,7,0,0,1,0,0,0,0,12
National Industry / Industrie nationale:,541410,Interior design services,Services de design d'intérieur,0,0,0,0,4,7,0,0,1,0,0,0,0,12
Industry / Industrie:,54142,Industrial design services,Services de design industriel,0,0,0,0,1,1,0,0,0,0,0,0,0,2
National Industry / Industrie nationale:,541420,Industrial design services,Services de design industriel,0,0,0,0,1,1,0,0,0,0,0,0,0,2
Industry / Industrie:,54143,Graphic design services,Services de design graphique,0,0,0,0,10,5,0,0,1,0,0,0,0,16
National Industry / Industrie nationale:,541430,Graphic design services,Services de design graphique,0,0,0,0,10,5,0,0,1,0,0,0,0,16
Industry / Industrie:,54149,Other specialized design services,Autres services spécialisés de design,0,0,0,0,5,1,0,0,1,0,0,0,0,7
National Industry / Industrie nationale:,541490,Other specialized design services,Autres services spécialisés de design,0,0,0,0,5,1,0,0,1,0,0,0,0,7
Industry Group / Groupe industriel:,5415,Computer systems design and related services,Conception de systèmes informatiques et services connexes,0,0,0,0,55,24,0,0,1,2,0,0,0,82
Industry / Industrie:,54151,Computer systems design and related services,Conception de systèmes informatiques et services connexes,0,0,0,0,55,24,0,0,1,2,0,0,0,82
National Industry / Industrie nationale:,541514,"Computer systems design and related services (except video game design
and development)","Conception de systèmes informatiques et services connexes (sauf la
conception et le développement de",0,0,0,0,55,24,0,0,1,1,0,0,0,81
National Industry / Industrie nationale:,541515,Video game design and development services,Services de conception et de développement de jeux vidéo,0,0,0,0,0,0,0,0,0,1,0,0,0,1
Industry Group / Groupe industriel:,5416,"Management, scientific and technical consulting services",Services de conseils en gestion et de conseils scientifiques et techniques,0,0,0,0,48,41,0,0,3,5,0,0,0,97
Industry / Industrie:,54161,Management consulting services,Services de conseils en gestion,0,0,0,0,43,34,0,0,2,3,0,0,0,82
National Industry / Industrie nationale:,541611,Administrative management and general management consulting services,Services de conseils en gestion administrative et générale,0,0,0,0,24,13,0,0,1,1,0,0,0,39
National Industry / Industrie nationale:,541612,Human resources consulting services,Services de conseils en ressources humaines,0,0,0,0,2,5,0,0,0,0,0,0,0,7
National Industry / Industrie nationale:,541619,Other management consulting services,Autres services de conseils en gestion,0,0,0,0,17,16,0,0,1,2,0,0,0,36
Industry / Industrie:,54162,Environmental consulting services,Services de conseils en environnement,0,0,0,0,0,3,0,0,1,0,0,0,0,4
National Industry / Industrie nationale:,541620,Environmental consulting services,Services de conseils en environnement,0,0,0,0,0,3,0,0,1,0,0,0,0,4
Industry / Industrie:,54169,Other scientific and technical consulting services,Autres services de conseils scientifiques et techniques,0,0,0,0,5,4,0,0,0,2,0,0,0,11
National Industry / Industrie nationale:,541690,Other scientific and technical consulting services,Autres services de conseils scientifiques et techniques,0,0,0,0,5,4,0,0,0,2,0,0,0,11
Industry Group / Groupe industriel:,5417,Scientific research and development services,Services de recherche et de développement scientifiques,0,1,0,0,7,1,0,1,0,1,0,0,0,11
Industry / Industrie:,54171,"Research and development in the physical, engineering and life sciences","Recherche et développement en sciences physiques, en génie et en
sciences de la vie",0,1,0,0,7,1,0,1,0,1,0,0,0,11
National Industry / Industrie nationale:,541710,"Research and development in the physical, engineering and life sciences","Recherche et développement en sciences physiques, en génie et en
sciences de la vie",0,1,0,0,7,1,0,1,0,1,0,0,0,11
Industry / Industrie:,54172,Research and development in the social sciences and humanities,"Recherche et développement, en sciences humaines et en sciences
sociales",0,0,0,0,0,0,0,0,0,0,0,0,0,0
National Industry / Industrie nationale:,541720,Research and development in the social sciences and humanities,"Recherche et développement, en sciences humaines et en sciences
sociales",0,0,0,0,0,0,0,0,0,0,0,0,0,0
Industry Group / Groupe industriel:,5418,"Advertising, public relations, and related services","Publicité, relations publiques et services connexes",0,0,0,1,29,13,0,0,0,1,0,0,0,44
Industry / Industrie:,54181,Advertising agencies,Agences de publicité,0,0,0,0,12,8,0,0,0,1,0,0,0,21
National Industry / Industrie nationale:,541810,Advertising agencies,Agences de publicité,0,0,0,0,12,8,0,0,0,1,0,0,0,21
Industry / Industrie:,54182,Public relations services,Services de relations publiques,0,0,0,0,1,0,0,0,0,0,0,0,0,1
National Industry / Industrie nationale:,541820,Public relations services,Services de relations publiques,0,0,0,0,1,0,0,0,0,0,0,0,0,1
Industry / Industrie:,54183,Media buying agencies,Agences d'achat de médias,0,0,0,0,0,0,0,0,0,0,0,0,0,0
National Industry / Industrie nationale:,541830,Media buying agencies,Agences d'achat de médias,0,0,0,0,0,0,0,0,0,0,0,0,0,0
Industry / Industrie:,54184,Media representatives,Représentants de médias,0,0,0,1,1,1,0,0,0,0,0,0,0,3
National Industry / Industrie nationale:,541840,Media representatives,Représentants de médias,0,0,0,1,1,1,0,0,0,0,0,0,0,3
Industry / Industrie:,54185,Display advertising,Publicité par affichage,0,0,0,0,1,1,0,0,0,0,0,0,0,2
National Industry / Industrie nationale:,541850,Display advertising,Publicité par affichage,0,0,0,0,1,1,0,0,0,0,0,0,0,2
Industry / Industrie:,54186,Direct mail advertising,Publipostage,0,0,0,0,0,1,0,0,0,0,0,0,0,1
National Industry / Industrie nationale:,541860,Direct mail advertising,Publipostage,0,0,0,0,0,1,0,0,0,0,0,0,0,1
Industry / Industrie:,54187,Advertising material distribution services,Services de distribution de matériel publicitaire,0,0,0,0,6,0,0,0,0,0,0,0,0,6
National Industry / Industrie nationale:,541870,Advertising material distribution services,Services de distribution de matériel publicitaire,0,0,0,0,6,0,0,0,0,0,0,0,0,6
Industry / Industrie:,54189,Other services related to advertising,Autres services liés à la publicité,0,0,0,0,8,2,0,0,0,0,0,0,0,10
National Industry / Industrie nationale:,541891,Specialty advertising distributors,Distributeurs de publicité par l'objet,0,0,0,0,3,1,0,0,0,0,0,0,0,4
National Industry / Industrie nationale:,541899,All other services related to advertising,Tous les autres services liés à la publicité,0,0,0,0,5,1,0,0,0,0,0,0,0,6
Industry Group / Groupe industriel:,5419,"Other professional, scientific and technical services","Autres services professionnels, scientifiques et techniques",0,0,0,1,13,17,1,0,1,1,0,0,0,34
Industry / Industrie:,54191,Marketing research and public opinion polling,Études de marché et sondages d'opinion,0,0,0,0,1,7,0,0,0,0,0,0,0,8
National Industry / Industrie nationale:,541910,Marketing research and public opinion polling,Études de marché et sondages d'opinion,0,0,0,0,1,7,0,0,0,0,0,0,0,8
Industry / Industrie:,54192,Photographic services,Services photographiques,0,0,0,0,5,6,0,0,0,1,0,0,0,12
National Industry / Industrie nationale:,541920,Photographic services,Services photographiques,0,0,0,0,5,6,0,0,0,1,0,0,0,12
Industry / Industrie:,54193,Translation and interpretation services,Services de traduction et d'interprétation,0,0,0,0,0,1,0,0,0,0,0,0,0,1
National Industry / Industrie nationale:,541930,Translation and interpretation services,Services de traduction et d'interprétation,0,0,0,0,0,1,0,0,0,0,0,0,0,1
Industry / Industrie:,54194,Veterinary services,Services vétérinaires,0,0,0,0,0,0,0,0,0,0,0,0,0,0
National Industry / Industrie nationale:,541940,Veterinary services,Services vétérinaires,0,0,0,0,0,0,0,0,0,0,0,0,0,0
Industry / Industrie:,54199,"All other professional, scientific and technical services","Tous les autres services professionnels, scientifiques et techniques",0,0,0,1,7,3,1,0,1,0,0,0,0,13
National Industry / Industrie nationale:,541990,"All other professional, scientific and technical services","Tous les autres services professionnels, scientifiques et techniques",0,0,0,1,7,3,1,0,1,0,0,0,0,13
Sector / Secteur:,55,Management of companies and enterprises,Gestion de sociétés et d'entreprises,0,0,0,0,90,19,4,2,5,6,0,0,0,126
Sub Sector / Sous-secteur:,551,Management of companies and enterprises,Gestion de sociétés et d'entreprises,0,0,0,0,90,19,4,2,5,6,0,0,0,126
Industry Group / Groupe industriel:,5511,Management of companies and enterprises,Gestion de sociétés et d'entreprises,0,0,0,0,90,19,4,2,5,6,0,0,0,126
Industry / Industrie:,55111,Management of companies and enterprises,Gestion de sociétés et d'entreprises,0,0,0,0,90,19,4,2,5,6,0,0,0,126
National Industry / Industrie nationale:,551113,Holding companies,Sociétés de portefeuille,0,0,0,0,84,19,4,2,5,5,0,0,0,119
National Industry / Industrie nationale:,551114,"Corporate, regional and subsidiary management offices and companies","Directions générales, régionales et filiales et sociétés",0,0,0,0,6,0,0,0,0,1,0,0,0,7
Sector / Secteur:,56,"Administrative and support, waste management and remediation services","Services administratifs, services de soutien, services de gestion des déchets
et services d'assainis",1,0,1,0,153,86,2,2,7,12,0,0,0,264
Sub Sector / Sous-secteur:,561,Administrative and support services,Services administratifs et services de soutien,1,0,1,0,149,85,2,1,6,11,0,0,0,256
Industry Group / Groupe industriel:,5611,Office administrative services,Services administratifs de bureau,1,0,0,0,8,5,0,0,0,1,0,0,0,15
Industry / Industrie:,56111,Office administrative services,Services administratifs de bureau,1,0,0,0,8,5,0,0,0,1,0,0,0,15
National Industry / Industrie nationale:,561110,Office administrative services,Services administratifs de bureau,1,0,0,0,8,5,0,0,0,1,0,0,0,15
Industry Group / Groupe industriel:,5612,Facilities support services,Services de soutien d'installations,0,0,0,0,0,1,0,0,0,0,0,0,0,1
Industry / Industrie:,56121,Facilities support services,Services de soutien d'installations,0,0,0,0,0,1,0,0,0,0,0,0,0,1
National Industry / Industrie nationale:,561210,Facilities support services,Services de soutien d'installations,0,0,0,0,0,1,0,0,0,0,0,0,0,1
Industry Group / Groupe industriel:,5613,Employment services,Services d'emploi,0,0,0,0,19,20,0,0,0,2,0,0,0,41
Industry / Industrie:,56131,Employment placement agencies and executive search services,Agences de placement et services de recherche de cadres,0,0,0,0,11,15,0,0,0,1,0,0,0,27
National Industry / Industrie nationale:,561310,Employment placement agencies and executive search services,Agences de placement et services de recherche de cadres,0,0,0,0,11,15,0,0,0,1,0,0,0,27
Industry / Industrie:,56132,Temporary help services,Location de personnel suppléant,0,0,0,0,6,2,0,0,0,1,0,0,0,9
National Industry / Industrie nationale:,561320,Temporary help services,Location de personnel suppléant,0,0,0,0,6,2,0,0,0,1,0,0,0,9
Industry / Industrie:,56133,Professional employer organizations,Location de personnel permanent,0,0,0,0,2,3,0,0,0,0,0,0,0,5
National Industry / Industrie nationale:,561330,Professional employer organizations,Location de personnel permanent,0,0,0,0,2,3,0,0,0,0,0,0,0,5
Industry Group / Groupe industriel:,5614,Business support services,Services de soutien aux entreprises,0,0,0,0,19,5,0,0,1,1,0,0,0,26
Industry / Industrie:,56141,Document preparation services,Services de préparation de documents,0,0,0,0,0,0,0,0,0,0,0,0,0,0
National Industry / Industrie nationale:,561410,Document preparation services,Services de préparation de documents,0,0,0,0,0,0,0,0,0,0,0,0,0,0
Industry / Industrie:,56142,Telephone call centres,Centres d'appels téléphoniques,0,0,0,0,4,0,0,0,0,0,0,0,0,4
National Industry / Industrie nationale:,561420,Telephone call centres,Centres d'appels téléphoniques,0,0,0,0,4,0,0,0,0,0,0,0,0,4
Industry / Industrie:,56143,Business service centres,Centres de services aux entreprises,0,0,0,0,3,1,0,0,0,1,0,0,0,5
National Industry / Industrie nationale:,561430,Business service centres,Centres de services aux entreprises,0,0,0,0,3,1,0,0,0,1,0,0,0,5
Industry / Industrie:,56144,Collection agencies,Agences de recouvrement,0,0,0,0,0,0,0,0,0,0,0,0,0,0
National Industry / Industrie nationale:,561440,Collection agencies,Agences de recouvrement,0,0,0,0,0,0,0,0,0,0,0,0,0,0
Industry / Industrie:,56145,Credit bureaus,Agences d'évaluation du crédit,0,0,0,0,0,1,0,0,0,0,0,0,0,1
National Industry / Industrie nationale:,561450,Credit bureaus,Agences d'évaluation du crédit,0,0,0,0,0,1,0,0,0,0,0,0,0,1
Industry / Industrie:,56149,Other business support services,Autres services de soutien aux entreprises,0,0,0,0,12,3,0,0,1,0,0,0,0,16
National Industry / Industrie nationale:,561490,Other business support services,Autres services de soutien aux entreprises,0,0,0,0,12,3,0,0,1,0,0,0,0,16
Industry Group / Groupe industriel:,5615,Travel arrangement and reservation services,Services de préparation de voyages et de réservation,0,0,0,0,8,3,0,0,0,0,0,0,0,11
Industry / Industrie:,56151,Travel agencies,Agences de voyage,0,0,0,0,6,2,0,0,0,0,0,0,0,8
National Industry / Industrie nationale:,561510,Travel agencies,Agences de voyage,0,0,0,0,6,2,0,0,0,0,0,0,0,8
Industry / Industrie:,56152,Tour operators,Voyagistes,0,0,0,0,1,0,0,0,0,0,0,0,0,1
National Industry / Industrie nationale:,561520,Tour operators,Voyagistes,0,0,0,0,1,0,0,0,0,0,0,0,0,1
Industry / Industrie:,56159,Other travel arrangement and reservation services,Autres services de préparation de voyages et de réservation,0,0,0,0,1,1,0,0,0,0,0,0,0,2
National Industry / Industrie nationale:,561590,Other travel arrangement and reservation services,Autres services de préparation de voyages et de réservation,0,0,0,0,1,1,0,0,0,0,0,0,0,2
Industry Group / Groupe industriel:,5616,Investigation and security services,Services d'enquêtes et de sécurité,0,0,0,0,7,8,0,0,2,1,0,0,0,18
Industry / Industrie:,56161,"Investigation, guard and armoured car services","Services d'enquêtes, de garde et de voitures blindées",0,0,0,0,5,4,0,0,1,1,0,0,0,11
National Industry / Industrie nationale:,561611,Investigation services,Services d'enquêtes,0,0,0,0,2,1,0,0,0,0,0,0,0,3
National Industry / Industrie nationale:,561612,Security guard and patrol services,Services de garde et de patrouille,0,0,0,0,3,3,0,0,1,1,0,0,0,8
National Industry / Industrie nationale:,561613,Armoured car services,Services de voitures blindées,0,0,0,0,0,0,0,0,0,0,0,0,0,0
Industry / Industrie:,56162,Security systems services,Services de systèmes de sécurité,0,0,0,0,2,4,0,0,1,0,0,0,0,7
National Industry / Industrie nationale:,561621,Security systems services (except locksmiths),Services de systèmes de sécurité (sauf les serruriers),0,0,0,0,2,4,0,0,1,0,0,0,0,7
National Industry / Industrie nationale:,561622,Locksmiths,Serruriers,0,0,0,0,0,0,0,0,0,0,0,0,0,0
Industry Group / Groupe industriel:,5617,Services to buildings and dwellings,Services relatifs aux bâtiments et aux logements,0,0,0,0,72,37,2,1,3,6,0,0,0,121
Industry / Industrie:,56171,Exterminating and pest control services,Services d'extermination et de lutte antiparasitaire,0,0,0,0,2,0,0,0,0,0,0,0,0,2
National Industry / Industrie nationale:,561710,Exterminating and pest control services,Services d'extermination et de lutte antiparasitaire,0,0,0,0,2,0,0,0,0,0,0,0,0,2
Industry / Industrie:,56172,Janitorial services,Services de conciergerie,0,0,0,0,31,19,2,1,2,3,0,0,0,58
National Industry / Industrie nationale:,561721,Window cleaning services,Services de nettoyage de vitres,0,0,0,0,0,0,0,0,0,0,0,0,0,0
National Industry / Industrie nationale:,561722,Janitorial services (except window cleaning),"Services de conciergerie, nettoyage (sauf les vitres)",0,0,0,0,31,19,2,1,2,3,0,0,0,58
Industry / Industrie:,56173,Landscaping services,Services d'aménagement paysager,0,0,0,0,29,16,0,0,1,3,0,0,0,49
National Industry / Industrie nationale:,561730,Landscaping services,Services d'aménagement paysager,0,0,0,0,29,16,0,0,1,3,0,0,0,49
Industry / Industrie:,56174,Carpet and upholstery cleaning services,Services de nettoyage de tapis et de meubles rembourrés,0,0,0,0,2,1,0,0,0,0,0,0,0,3
National Industry / Industrie nationale:,561740,Carpet and upholstery cleaning services,Services de nettoyage de tapis et de meubles rembourrés,0,0,0,0,2,1,0,0,0,0,0,0,0,3
Industry / Industrie:,56179,Other services to buildings and dwellings,Autres services relatifs aux bâtiments et aux logements,0,0,0,0,8,1,0,0,0,0,0,0,0,9
National Industry / Industrie nationale:,561791,Duct and chimney cleaning services,Services de nettoyage de conduits et de cheminées,0,0,0,0,1,0,0,0,0,0,0,0,0,1
National Industry / Industrie nationale:,561799,All other services to buildings and dwellings,Tous les autres services relatifs aux bâtiments et aux logements,0,0,0,0,7,1,0,0,0,0,0,0,0,8
Industry Group / Groupe industriel:,5619,Other support services,Autres services de soutien,0,0,1,0,16,6,0,0,0,0,0,0,0,23
Industry / Industrie:,56191,Packaging and labelling services,Services d'emballage et d'étiquetage,0,0,0,0,1,1,0,0,0,0,0,0,0,2
National Industry / Industrie nationale:,561910,Packaging and labelling services,Services d'emballage et d'étiquetage,0,0,0,0,1,1,0,0,0,0,0,0,0,2
Industry / Industrie:,56192,Convention and trade show organizers,"Organisateurs de congrès, de salons et de foires commerciales",0,0,1,0,0,0,0,0,0,0,0,0,0,1
National Industry / Industrie nationale:,561920,Convention and trade show organizers,"Organisateurs de congrès, de salons et de foires commerciales",0,0,1,0,0,0,0,0,0,0,0,0,0,1
Industry / Industrie:,56199,All other support services,Tous les autres services de soutien,0,0,0,0,15,5,0,0,0,0,0,0,0,20
National Industry / Industrie nationale:,561990,All other support services,Tous les autres services de soutien,0,0,0,0,15,5,0,0,0,0,0,0,0,20
Sub Sector / Sous-secteur:,562,Waste management and remediation services,Services de gestion des déchets et d'assainissement,0,0,0,0,4,1,0,1,1,1,0,0,0,8
Industry Group / Groupe industriel:,5621,Waste collection,Collecte de déchets,0,0,0,0,0,1,0,0,0,1,0,0,0,2
Industry / Industrie:,56211,Waste collection,Collecte de déchets,0,0,0,0,0,1,0,0,0,1,0,0,0,2
National Industry / Industrie nationale:,562110,Waste collection,Collecte de déchets,0,0,0,0,0,1,0,0,0,1,0,0,0,2
Industry Group / Groupe industriel:,5622,Waste treatment and disposal,Traitement et élimination des déchets,0,0,0,0,0,0,0,0,0,0,0,0,0,0
Industry / Industrie:,56221,Waste treatment and disposal,Traitement et élimination des déchets,0,0,0,0,0,0,0,0,0,0,0,0,0,0
National Industry / Industrie nationale:,562210,Waste treatment and disposal,Traitement et élimination des déchets,0,0,0,0,0,0,0,0,0,0,0,0,0,0
Industry Group / Groupe industriel:,5629,Remediation and other waste management services,Services d'assainissement et autres services de gestion des déchets,0,0,0,0,4,0,0,1,1,0,0,0,0,6
Industry / Industrie:,56291,Remediation services,Services d'assainissement,0,0,0,0,0,0,0,1,0,0,0,0,0,1
National Industry / Industrie nationale:,562910,Remediation services,Services d'assainissement,0,0,0,0,0,0,0,1,0,0,0,0,0,1
Industry / Industrie:,56292,Material recovery facilities,Installations de récupération de matériaux,0,0,0,0,1,0,0,0,0,0,0,0,0,1
National Industry / Industrie nationale:,562920,Material recovery facilities,Installations de récupération de matériaux,0,0,0,0,1,0,0,0,0,0,0,0,0,1
Industry / Industrie:,56299,All other waste management services,Tous les autres services de gestion des déchets,0,0,0,0,3,0,0,0,1,0,0,0,0,4
National Industry / Industrie nationale:,562990,All other waste management services,Tous les autres services de gestion des déchets,0,0,0,0,3,0,0,0,1,0,0,0,0,4
Sector / Secteur:,61,Educational services,Services d'enseignement,0,0,1,2,35,20,0,0,1,2,0,0,0,61
Sub Sector / Sous-secteur:,611,Educational services,Services d'enseignement,0,0,1,2,35,20,0,0,1,2,0,0,0,61
Industry Group / Groupe industriel:,6111,Elementary and secondary schools,Écoles primaires et secondaires,0,0,0,0,0,2,0,0,0,0,0,0,0,2
Industry / Industrie:,61111,Elementary and secondary schools,Écoles primaires et secondaires,0,0,0,0,0,2,0,0,0,0,0,0,0,2
National Industry / Industrie nationale:,611110,Elementary and secondary schools,Écoles primaires et secondaires,0,0,0,0,0,2,0,0,0,0,0,0,0,2
Industry Group / Groupe industriel:,6112,Community colleges and C.E.G.E.P.s,Collèges communautaires et cégeps,0,0,0,0,0,0,0,0,0,0,0,0,0,0
Industry / Industrie:,61121,Community colleges and C.E.G.E.P.s,Collèges communautaires et cégeps,0,0,0,0,0,0,0,0,0,0,0,0,0,0
National Industry / Industrie nationale:,611210,Community colleges and C.E.G.E.P.s,Collèges communautaires et cégeps,0,0,0,0,0,0,0,0,0,0,0,0,0,0
Industry Group / Groupe industriel:,6113,Universities,Universités,0,0,0,0,0,0,0,0,0,0,0,0,0,0
Industry / Industrie:,61131,Universities,Universités,0,0,0,0,0,0,0,0,0,0,0,0,0,0
National Industry / Industrie nationale:,611310,Universities,Universités,0,0,0,0,0,0,0,0,0,0,0,0,0,0
Industry Group / Groupe industriel:,6114,Business schools and computer and management training,Écoles de commerce et de formation en informatique et en gestion,0,0,0,0,2,1,0,0,0,0,0,0,0,3
Industry / Industrie:,61141,Business and secretarial schools,Écoles de commerce et de secrétariat,0,0,0,0,0,0,0,0,0,0,0,0,0,0
National Industry / Industrie nationale:,611410,Business and secretarial schools,Écoles de commerce et de secrétariat,0,0,0,0,0,0,0,0,0,0,0,0,0,0
Industry / Industrie:,61142,Computer training,Formation en informatique,0,0,0,0,1,0,0,0,0,0,0,0,0,1
National Industry / Industrie nationale:,611420,Computer training,Formation en informatique,0,0,0,0,1,0,0,0,0,0,0,0,0,1
Industry / Industrie:,61143,Professional and management development training,Formation professionnelle et perfectionnement en gestion,0,0,0,0,1,1,0,0,0,0,0,0,0,2
National Industry / Industrie nationale:,611430,Professional and management development training,Formation professionnelle et perfectionnement en gestion,0,0,0,0,1,1,0,0,0,0,0,0,0,2
Industry Group / Groupe industriel:,6115,Technical and trade schools,Écoles techniques et écoles de métiers,0,0,0,0,4,0,0,0,0,0,0,0,0,4
Industry / Industrie:,61151,Technical and trade schools,Écoles techniques et écoles de métiers,0,0,0,0,4,0,0,0,0,0,0,0,0,4
