National Industry / Industrie nationale:,441110,New car dealers,Concessionnaires d'automobiles neuves,0,0,0,0,2,0,0,0,1,0,0,0,0,3
Industry / Industrie:,44112,Used car dealers,Concessionnaires d'automobiles d'occasion,0,0,0,0,16,1,0,0,1,2,0,0,0,20
National Industry / Industrie nationale:,441120,Used car dealers,Concessionnaires d'automobiles d'occasion,0,0,0,0,16,1,0,0,1,2,0,0,0,20
Industry Group / Groupe industriel:,4412,Other motor vehicle dealers,Autres concessionnaires de véhicules automobiles,0,0,0,0,0,3,0,0,1,4,0,0,0,8
Industry / Industrie:,44121,Recreational vehicle dealers,Concessionnaires de véhicules récréatifs,0,0,0,0,0,1,0,0,1,2,0,0,0,4
National Industry / Industrie nationale:,441210,Recreational vehicle dealers,Concessionnaires de véhicules récréatifs,0,0,0,0,0,1,0,0,1,2,0,0,0,4
Industry / Industrie:,44122,"Motorcycle, boat and other motor vehicle dealers","Concessionnaires de motocyclettes, de bateaux et d'autres véhicules
automobiles",0,0,0,0,0,2,0,0,0,2,0,0,0,4
National Industry / Industrie nationale:,441220,"Motorcycle, boat and other motor vehicle dealers","Concessionnaires de motocyclettes, de bateaux et d'autres véhicules
automobiles",0,0,0,0,0,2,0,0,0,2,0,0,0,4
Industry Group / Groupe industriel:,4413,"Automotive parts, accessories and tire retailers","Détaillants de pièces, de pneus et d'accessoires pour véhicules automobiles",0,0,0,0,4,4,0,0,0,1,0,0,0,9
Industry / Industrie:,44133,Automotive parts and accessories retailers,Détaillants de pièces et d'accessoires pour véhicules automobiles,0,0,0,0,2,4,0,0,0,1,0,0,0,7
National Industry / Industrie nationale:,441330,Automotive parts and accessories retailers,Détaillants de pièces et d'accessoires pour véhicules automobiles,0,0,0,0,2,4,0,0,0,1,0,0,0,7
Industry / Industrie:,44134,Tire dealers,Marchands de pneus,0,0,0,0,2,0,0,0,0,0,0,0,0,2
National Industry / Industrie nationale:,441340,Tire dealers,Marchands de pneus,0,0,0,0,2,0,0,0,0,0,0,0,0,2
Sub Sector / Sous-secteur:,444,Building material and garden equipment and supplies dealers,"Marchands de matériaux de construction et de matériel et fournitures de
jardinage",0,0,0,0,13,6,1,0,2,0,0,0,0,22
Industry Group / Groupe industriel:,4441,Building material and supplies dealers,Marchands de matériaux et fournitures de construction,0,0,0,0,13,4,1,0,0,0,0,0,0,18
Industry / Industrie:,44411,Home centres,Centres de rénovation,0,0,0,0,0,1,0,0,0,0,0,0,0,1
National Industry / Industrie nationale:,444110,Home centres,Centres de rénovation,0,0,0,0,0,1,0,0,0,0,0,0,0,1
Industry / Industrie:,44412,Paint and wallpaper retailers,Détaillants de peinture et de papier peint,0,0,0,0,3,0,0,0,0,0,0,0,0,3
National Industry / Industrie nationale:,444120,Paint and wallpaper retailers,Détaillants de peinture et de papier peint,0,0,0,0,3,0,0,0,0,0,0,0,0,3
Industry / Industrie:,44414,Hardware retailers,Quincailleries,0,0,0,0,3,0,0,0,0,0,0,0,0,3
National Industry / Industrie nationale:,444140,Hardware retailers,Quincailleries,0,0,0,0,3,0,0,0,0,0,0,0,0,3
Industry / Industrie:,44418,Other building material dealers,Autres marchands de matériaux de construction,0,0,0,0,7,3,1,0,0,0,0,0,0,11
National Industry / Industrie nationale:,444180,Other building material dealers,Autres marchands de matériaux de construction,0,0,0,0,7,3,1,0,0,0,0,0,0,11
Industry Group / Groupe industriel:,4442,Lawn and garden equipment and supplies retailers,"Détaillants de matériel et fournitures pour le jardinage et l'entretien des
pelouses",0,0,0,0,0,2,0,0,2,0,0,0,0,4
Industry / Industrie:,44423,Outdoor power equipment retailers,Détaillants de matériel motorisé pour l'extérieur,0,0,0,0,0,0,0,0,1,0,0,0,0,1
National Industry / Industrie nationale:,444230,Outdoor power equipment retailers,Détaillants de matériel motorisé pour l'extérieur,0,0,0,0,0,0,0,0,1,0,0,0,0,1
Industry / Industrie:,44424,Nursery retailers and garden centres,Pépinières et centres de jardinage,0,0,0,0,0,2,0,0,1,0,0,0,0,3
National Industry / Industrie nationale:,444240,Nursery retailers and garden centres,Pépinières et centres de jardinage,0,0,0,0,0,2,0,0,1,0,0,0,0,3
Sub Sector / Sous-secteur:,445,Food and beverage retailers,Détaillants d'alimentation,0,1,0,4,123,19,0,2,4,6,0,0,0,159
Industry Group / Groupe industriel:,4451,Grocery and convenience retailers,Épiceries et dépanneurs,0,0,0,0,56,12,0,2,1,4,0,0,0,75
Industry / Industrie:,44511,Supermarkets and other grocery retailers (except Convenience retailers),Supermarchés et autres épiceries (sauf les dépanneurs),0,0,0,0,36,7,0,1,1,2,0,0,0,47
National Industry / Industrie nationale:,445110,Supermarkets and other grocery retailers (except Convenience retailers),Supermarchés et autres épiceries (sauf les dépanneurs),0,0,0,0,36,7,0,1,1,2,0,0,0,47
Industry / Industrie:,44513,Convenience retailers and vending machine operators,Dépanneurs et exploitants de distributeurs automatiques,0,0,0,0,20,5,0,1,0,2,0,0,0,28
National Industry / Industrie nationale:,445131,Convenience retailers,Dépanneurs,0,0,0,0,19,5,0,1,0,2,0,0,0,27
National Industry / Industrie nationale:,445132,Vending machine operators,Exploitants de distributeurs automatiques,0,0,0,0,1,0,0,0,0,0,0,0,0,1
Industry Group / Groupe industriel:,4452,Specialty food retailers,Détaillants d'alimentation spécialisés,0,1,0,4,59,7,0,0,1,2,0,0,0,74
Industry / Industrie:,44523,Fruit and vegetable markets,Marchés de fruits et de légumes,0,0,0,0,2,1,0,0,1,0,0,0,0,4
National Industry / Industrie nationale:,445230,Fruit and vegetable markets,Marchés de fruits et de légumes,0,0,0,0,2,1,0,0,1,0,0,0,0,4
Industry / Industrie:,44524,Meat markets,Boucheries,0,0,0,0,5,3,0,0,0,0,0,0,0,8
National Industry / Industrie nationale:,445240,Meat markets,Boucheries,0,0,0,0,5,3,0,0,0,0,0,0,0,8
Industry / Industrie:,44525,Fish and seafood markets,Poissonneries,0,0,0,3,2,1,0,0,0,0,0,0,0,6
National Industry / Industrie nationale:,445250,Fish and seafood markets,Poissonneries,0,0,0,3,2,1,0,0,0,0,0,0,0,6
Industry / Industrie:,44529,Other specialty food retailers,Autres détaillants d'alimentation spécialisés,0,1,0,1,50,2,0,0,0,2,0,0,0,56
National Industry / Industrie nationale:,445291,Baked goods retailers,Boulangeries-pâtisseries,0,0,0,1,23,0,0,0,0,0,0,0,0,24
National Industry / Industrie nationale:,445292,Confectionery and nut retailers,Confiseries et détaillants de noix,0,0,0,0,2,0,0,0,0,0,0,0,0,2
National Industry / Industrie nationale:,445298,All other specialty food retailers,Tous les autres détaillants d'alimentation spécialisés,0,1,0,0,25,2,0,0,0,2,0,0,0,30
Industry Group / Groupe industriel:,4453,"Beer, wine and liquor retailers","Détaillants de bière, de vin et de spiritueux",0,0,0,0,8,0,0,0,2,0,0,0,0,10
Industry / Industrie:,44532,"Beer, wine and liquor retailers","Détaillants de bière, de vin et de spiritueux",0,0,0,0,8,0,0,0,2,0,0,0,0,10
National Industry / Industrie nationale:,445320,"Beer, wine and liquor retailers","Détaillants de bière, de vin et de spiritueux",0,0,0,0,8,0,0,0,2,0,0,0,0,10
Sub Sector / Sous-secteur:,449,"Furniture, home furnishings, electronics and appliances retailers","Détaillants de meubles, accessoires de maison, appareils électroniques et
ménagers",0,0,0,1,24,17,2,0,0,1,0,0,0,45
Industry Group / Groupe industriel:,4491,"Furniture, floor covering, window treatment and other home furnishings
retailers","Détaillants de meubles, de revêtements de sol, garnitures de fenêtres et
d'accessoires de maisons",0,0,0,1,11,10,2,0,0,1,0,0,0,25
Industry / Industrie:,44911,Furniture retailers,Détaillants de meubles,0,0,0,1,8,1,0,0,0,0,0,0,0,10
National Industry / Industrie nationale:,449110,Furniture retailers,Détaillants de meubles,0,0,0,1,8,1,0,0,0,0,0,0,0,10
Industry / Industrie:,44912,"Floor covering, window treatment and other home furnishing retailers","Détaillants de revêtements de sol, garnitures de fenêtres et autres
accessoires de maison",0,0,0,0,3,9,2,0,0,1,0,0,0,15
National Industry / Industrie nationale:,449121,Floor covering retailers,Détaillants de revêtements de sol,0,0,0,0,3,4,0,0,0,0,0,0,0,7
National Industry / Industrie nationale:,449122,Window treatment retailers,Détaillants de garnitures de fenêtres,0,0,0,0,0,0,0,0,0,1,0,0,0,1
National Industry / Industrie nationale:,449123,Print and picture frame retailers,Détaillants de matériel d'encadrement,0,0,0,0,0,1,0,0,0,0,0,0,0,1
National Industry / Industrie nationale:,449129,All other home furnishing retailers,Détaillants de tous les autres accessoires de maison,0,0,0,0,0,4,2,0,0,0,0,0,0,6
Industry Group / Groupe industriel:,4492,Electronics and appliances retailers,Détaillants d'appareils électroniques et ménagers,0,0,0,0,13,7,0,0,0,0,0,0,0,20
Industry / Industrie:,44921,Electronics and appliances retailers,Détaillants d'appareils électroniques et ménagers,0,0,0,0,13,7,0,0,0,0,0,0,0,20
National Industry / Industrie nationale:,449211,"Appliance, television and other electronics retailers","Détaillants d'appareils ménagers, de téléviseurs et d'autres appareils
électroniques",0,0,0,0,5,3,0,0,0,0,0,0,0,8
National Industry / Industrie nationale:,449212,Computer and software retailers,Détaillants d'ordinateurs et de logiciels,0,0,0,0,8,4,0,0,0,0,0,0,0,12
National Industry / Industrie nationale:,449213,Camera and photographic supplies retailers,Détaillants d'appareils et fournitures photographiques,0,0,0,0,0,0,0,0,0,0,0,0,0,0
National Industry / Industrie nationale:,449214,Audio and video recording retailers,Détaillants d'enregistrements vidéo et audio,0,0,0,0,0,0,0,0,0,0,0,0,0,0
Sector / Secteur:,45,Retail Trade,Commerce de détail,2,4,0,1,148,83,8,1,10,14,0,0,0,271
Sub Sector / Sous-secteur:,455,General merchandise retailers,Détaillants de marchandises diverses,0,1,0,0,8,8,0,0,0,1,0,0,0,18
Industry Group / Groupe industriel:,4551,Department stores,Grands détaillants,0,1,0,0,2,2,0,0,0,1,0,0,0,6
Industry / Industrie:,45511,Department stores,Grands détaillants,0,1,0,0,2,2,0,0,0,1,0,0,0,6
National Industry / Industrie nationale:,455110,Department stores,Grands détaillants,0,1,0,0,2,2,0,0,0,1,0,0,0,6
Industry Group / Groupe industriel:,4552,"Warehouse clubs, Supercentres and other general merchandise retailers","Clubs-entrepôts, supercentres et autres détaillants de marchandises
diverses",0,0,0,0,6,6,0,0,0,0,0,0,0,12
Industry / Industrie:,45521,"Warehouse clubs, Supercentres and other general merchandise retailers","Clubs-entrepôts, supercentres et autres détaillants de marchandises
diverses",0,0,0,0,6,6,0,0,0,0,0,0,0,12
National Industry / Industrie nationale:,455211,Warehouse clubs and Supercentres,"Clubs-entrepôts, supercentres",0,0,0,0,0,0,0,0,0,0,0,0,0,0
National Industry / Industrie nationale:,455212,Home and auto supplies retailers,Détaillants de fournitures pour la maison et l'auto,0,0,0,0,0,0,0,0,0,0,0,0,0,0
National Industry / Industrie nationale:,455219,All other miscellaneous general merchandise retailers,Tous les autres détaillants de marchandises diverses de tout genre,0,0,0,0,6,6,0,0,0,0,0,0,0,12
Sub Sector / Sous-secteur:,456,Health and personal care retailers,Détaillants de produits de santé et de soins personnels,0,1,0,0,19,13,1,0,2,3,0,0,0,39
Industry Group / Groupe industriel:,4561,Health and personal care retailers,Détaillants de produits de santé et de soins personnels,0,1,0,0,19,13,1,0,2,3,0,0,0,39
Industry / Industrie:,45611,Pharmacies and drug stores,Pharmacies,0,0,0,0,2,1,0,0,0,0,0,0,0,3
National Industry / Industrie nationale:,456110,Pharmacies and drug stores,Pharmacies,0,0,0,0,2,1,0,0,0,0,0,0,0,3
Industry / Industrie:,45612,"Cosmetics, beauty supplies and perfume retailers","Détaillants de cosmétiques, de produits de beauté et de parfums",0,0,0,0,3,10,1,0,1,1,0,0,0,16
National Industry / Industrie nationale:,456120,"Cosmetics, beauty supplies and perfume retailers","Détaillants de cosmétiques, de produits de beauté et de parfums",0,0,0,0,3,10,1,0,1,1,0,0,0,16
Industry / Industrie:,45613,Optical goods retailers,Détaillants de produits optiques,0,0,0,0,3,0,0,0,0,0,0,0,0,3
National Industry / Industrie nationale:,456130,Optical goods retailers,Détaillants de produits optiques,0,0,0,0,3,0,0,0,0,0,0,0,0,3
Industry / Industrie:,45619,Other health and personal care retailers,Détaillants d'autres produits de santé et de soins personnels,0,1,0,0,11,2,0,0,1,2,0,0,0,17
National Industry / Industrie nationale:,456191,Food (health) supplement retailers,Détaillants de suppléments alimentaires (aliments de santé),0,1,0,0,7,1,0,0,1,1,0,0,0,11
National Industry / Industrie nationale:,456199,All other health and personal care retailers,Détaillants de tous les autres produits de santé et de soins personnels,0,0,0,0,4,1,0,0,0,1,0,0,0,6
Sub Sector / Sous-secteur:,457,Gasoline stations and fuel vendors,Stations-service et marchands de combustibles,0,0,0,0,10,7,0,0,0,0,0,0,0,17
Industry Group / Groupe industriel:,4571,Gasoline stations,Stations-service,0,0,0,0,10,6,0,0,0,0,0,0,0,16
Industry / Industrie:,45711,Gasoline stations with convenience stores,Stations-service avec dépanneurs,0,0,0,0,10,6,0,0,0,0,0,0,0,16
National Industry / Industrie nationale:,457110,Gasoline stations with convenience stores,Stations-service avec dépanneurs,0,0,0,0,10,6,0,0,0,0,0,0,0,16
Industry / Industrie:,45712,Other gasoline stations,Autres stations-service,0,0,0,0,0,0,0,0,0,0,0,0,0,0
National Industry / Industrie nationale:,457120,Other gasoline stations,Autres stations-service,0,0,0,0,0,0,0,0,0,0,0,0,0,0
Industry Group / Groupe industriel:,4572,Fuel dealers,Marchands de combustibles,0,0,0,0,0,1,0,0,0,0,0,0,0,1
Industry / Industrie:,45721,Fuel dealers,Marchands de combustibles,0,0,0,0,0,1,0,0,0,0,0,0,0,1
National Industry / Industrie nationale:,457211,Heating oil dealers,Marchands de mazout de chauffage,0,0,0,0,0,0,0,0,0,0,0,0,0,0
National Industry / Industrie nationale:,457212,Liquefied petroleum gas (bottled gas) dealers,Marchands de gaz de pétrole liquéfiés (gaz en bouteille),0,0,0,0,0,1,0,0,0,0,0,0,0,1
National Industry / Industrie nationale:,457219,Other fuel dealers,Autres marchands de combustibles,0,0,0,0,0,0,0,0,0,0,0,0,0,0
Sub Sector / Sous-secteur:,458,"Clothing, clothing accessories, shoes, jewelry, luggage and leather goods
retailers","Détaillants de vêtements , d'accessoires vestimentaires, de chaussures,
bijouteries, bagages et de m",1,1,0,0,45,22,6,0,2,4,0,0,0,81
Industry Group / Groupe industriel:,4581,Clothing and clothing accessories retailers,Détaillants de vêtements et d'accessoires vestimentaires,1,1,0,0,38,14,6,0,2,4,0,0,0,66
Industry / Industrie:,45811,Clothing and clothing accessories retailers,Détaillants de vêtements et d'accessoires vestimentaires,1,1,0,0,38,14,6,0,2,4,0,0,0,66
National Industry / Industrie nationale:,458111,Men's clothing retailers,Détaillants de vêtements pour hommes,0,0,0,0,4,0,0,0,0,1,0,0,0,5
National Industry / Industrie nationale:,458112,Women's clothing retailers,Détaillants de vêtements pour femmes,0,1,0,0,7,4,5,0,1,1,0,0,0,19
National Industry / Industrie nationale:,458113,Children's and infants' clothing retailers,Détaillants de vêtements pour enfants et bébés,0,0,0,0,4,1,0,0,1,0,0,0,0,6
National Industry / Industrie nationale:,458114,Family clothing retailers,Détaillants de vêtements pour la famille,0,0,0,0,10,2,0,0,0,0,0,0,0,12
National Industry / Industrie nationale:,458115,Clothing accessories retailers,Détaillants d'accessoires vestimentaires,0,0,0,0,0,2,0,0,0,0,0,0,0,2
National Industry / Industrie nationale:,458116,Fur retailers,Détaillants de fourrures,0,0,0,0,0,1,0,0,0,0,0,0,0,1
National Industry / Industrie nationale:,458119,All other clothing retailers,Détaillants de tous les autres types de vêtements,1,0,0,0,13,4,1,0,0,2,0,0,0,21
Industry Group / Groupe industriel:,4582,Shoe retailers,Détaillants de chaussures,0,0,0,0,5,3,0,0,0,0,0,0,0,8
Industry / Industrie:,45821,Shoe retailers,Détaillants de chaussures,0,0,0,0,5,3,0,0,0,0,0,0,0,8
National Industry / Industrie nationale:,458210,Shoe retailers,Détaillants de chaussures,0,0,0,0,5,3,0,0,0,0,0,0,0,8
Industry Group / Groupe industriel:,4583,"Jewellery, luggage and leather goods retailers",Bijouteries et détaillants de bagages et de maroquinerie,0,0,0,0,2,5,0,0,0,0,0,0,0,7
Industry / Industrie:,45831,Jewellery retailers,Bijouteries,0,0,0,0,2,4,0,0,0,0,0,0,0,6
National Industry / Industrie nationale:,458310,Jewellery retailers,Bijouteries,0,0,0,0,2,4,0,0,0,0,0,0,0,6
Industry / Industrie:,45832,Luggage and leather goods retailers,Détaillants de bagages et de maroquinerie,0,0,0,0,0,1,0,0,0,0,0,0,0,1
National Industry / Industrie nationale:,458320,Luggage and leather goods retailers,Détaillants de bagages et de maroquinerie,0,0,0,0,0,1,0,0,0,0,0,0,0,1
Sub Sector / Sous-secteur:,459,"Sporting goods, hobby, musical instrument, book, and miscellaneous
retailers","Détaillants d'articles de sport et de passe-temps et d'instruments de
musique et de détails divers",1,1,0,1,66,33,1,1,6,6,0,0,0,116
Industry Group / Groupe industriel:,4591,"Sporting goods, hobby and musical instrument retailers","Détaillants d'articles de sport, de passe-temps et d'instruments de musique",1,1,0,0,19,7,0,0,2,2,0,0,0,32
Industry / Industrie:,45911,Sporting goods retailers,Détaillants d'articles de sport,0,0,0,0,8,5,0,0,2,2,0,0,0,17
National Industry / Industrie nationale:,459111,Golf equipment and supplies specialty retailers,Détaillants spécialisés en équipement et en fournitures de golf,0,0,0,0,1,0,0,0,0,0,0,0,0,1
National Industry / Industrie nationale:,459112,Ski equipment and supplies specialty retailers,Détaillants spécialisés en équipement et en fournitures de ski,0,0,0,0,0,0,0,0,0,0,0,0,0,0
National Industry / Industrie nationale:,459113,Cycling equipment and supplies specialty retailers,Détaillants spécialisés en équipement et en fournitures de cyclisme,0,0,0,0,2,0,0,0,0,0,0,0,0,2
National Industry / Industrie nationale:,459119,All other sporting goods retailers,Tous les autres détaillants d'articles de sport,0,0,0,0,5,5,0,0,2,2,0,0,0,14
Industry / Industrie:,45912,"Hobby, toy and game retailers","Détaillants d'articles de passe-temps, de jouets et de jeux",1,1,0,0,6,1,0,0,0,0,0,0,0,9
National Industry / Industrie nationale:,459120,"Hobby, toy and game retailers","Détaillants d'articles de passe-temps, de jouets et de jeux",1,1,0,0,6,1,0,0,0,0,0,0,0,9
Industry / Industrie:,45913,"Sewing, needlework and piece goods retailers",Détaillants d'articles de couture et de travaux d'aiguille et de tissus à la pièce,0,0,0,0,4,0,0,0,0,0,0,0,0,4
National Industry / Industrie nationale:,459130,"Sewing, needlework and piece goods retailers",Détaillants d'articles de couture et de travaux d'aiguille et de tissus à la pièce,0,0,0,0,4,0,0,0,0,0,0,0,0,4
Industry / Industrie:,45914,Musical instrument and supplies retailers,Détaillants d'instruments et de fournitures de musique,0,0,0,0,1,1,0,0,0,0,0,0,0,2
National Industry / Industrie nationale:,459140,Musical instrument and supplies retailers,Détaillants d'instruments et de fournitures de musique,0,0,0,0,1,1,0,0,0,0,0,0,0,2
Industry Group / Groupe industriel:,4592,Book retailers and news dealers,Librairies et marchands de journaux,0,0,0,0,7,1,0,0,0,0,0,0,0,8
Industry / Industrie:,45921,Book retailers and news dealers,Librairies et marchands de journaux,0,0,0,0,7,1,0,0,0,0,0,0,0,8
National Industry / Industrie nationale:,459210,Book retailers and news dealers,Librairies et marchands de journaux,0,0,0,0,7,1,0,0,0,0,0,0,0,8
Industry Group / Groupe industriel:,4593,Florists,Fleuristes,0,0,0,0,5,0,0,0,0,0,0,0,0,5
Industry / Industrie:,45931,Florists,Fleuristes,0,0,0,0,5,0,0,0,0,0,0,0,0,5
National Industry / Industrie nationale:,459310,Florists,Fleuristes,0,0,0,0,5,0,0,0,0,0,0,0,0,5
Industry Group / Groupe industriel:,4594,"Office supplies, stationery and gift retailers","Détaillants de fournitures de bureau, de papeterie et de cadeaux",0,0,0,0,4,2,1,0,1,0,0,0,0,8
Industry / Industrie:,45941,Office supplies and stationery retailers,Détaillants de fournitures de bureau et de papeterie,0,0,0,0,1,0,0,0,0,0,0,0,0,1
National Industry / Industrie nationale:,459410,Office supplies and stationery retailers,Détaillants de fournitures de bureau et de papeterie,0,0,0,0,1,0,0,0,0,0,0,0,0,1
Industry / Industrie:,45942,"Gift, novelty and souvenir retailers","Détaillants de cadeaux, d'articles de fantaisie et de souvenirs",0,0,0,0,3,2,1,0,1,0,0,0,0,7
National Industry / Industrie nationale:,459420,"Gift, novelty and souvenir retailers","Détaillants de cadeaux, d'articles de fantaisie et de souvenirs",0,0,0,0,3,2,1,0,1,0,0,0,0,7
Industry Group / Groupe industriel:,4595,Used merchandise retailers,Détaillants de marchandises d'occasion,0,0,0,0,4,3,0,0,1,0,0,0,0,8
Industry / Industrie:,45951,Used merchandise retailers,Détaillants de marchandises d'occasion,0,0,0,0,4,3,0,0,1,0,0,0,0,8
National Industry / Industrie nationale:,459510,Used merchandise retailers,Détaillants de marchandises d'occasion,0,0,0,0,4,3,0,0,1,0,0,0,0,8
Industry Group / Groupe industriel:,4599,Other miscellaneous store retailers,Autres détaillants de détail divers,0,0,0,1,27,20,0,1,2,4,0,0,0,55
Industry / Industrie:,45991,Pet and pet supplies retailers,Animaleries et détaillants de fournitures pour animaux,0,0,0,0,7,4,0,0,0,1,0,0,0,12
National Industry / Industrie nationale:,459910,Pet and pet supplies retailers,Animaleries et détaillants de fournitures pour animaux,0,0,0,0,7,4,0,0,0,1,0,0,0,12
Industry / Industrie:,45992,Art dealers,Marchands d'oeuvres d'art,0,0,0,0,0,1,0,0,0,0,0,0,0,1
National Industry / Industrie nationale:,459920,Art dealers,Marchands d'oeuvres d'art,0,0,0,0,0,1,0,0,0,0,0,0,0,1
Industry / Industrie:,45993,Manufactured (mobile) home dealers,Marchands de maisons préfabriquées (mobiles),0,0,0,0,0,1,0,0,0,0,0,0,0,1
National Industry / Industrie nationale:,459930,Manufactured (mobile) home dealers,Marchands de maisons préfabriquées (mobiles),0,0,0,0,0,1,0,0,0,0,0,0,0,1
Industry / Industrie:,45999,All other miscellaneous retailers,Tous les autres détaillants de détail divers,0,0,0,1,20,14,0,1,2,3,0,0,0,41
National Industry / Industrie nationale:,459992,Beer and wine-making supplies retailers,Détaillants de matériel pour la fabrication de la bière et du vin,0,0,0,0,2,0,0,0,1,0,0,0,0,3
National Industry / Industrie nationale:,459993,Cannabis retailers,Détaillants de cannabis,0,0,0,0,0,6,0,0,0,2,0,0,0,8
National Industry / Industrie nationale:,459999,"All other miscellaneous retailers (except beer and wine-making supplies
retailers)","Tous les autres détaillants de détail divers (sauf les détaillants de matériel
pour la fabrication d",0,0,0,1,18,8,0,1,1,1,0,0,0,30
Sector / Secteur:,48,Transportation and warehousing,Transport et entreposage,0,3,3,0,255,103,5,6,10,12,0,0,0,397
Sub Sector / Sous-secteur:,481,Air transportation,Transport aérien,0,0,0,0,4,0,0,0,0,1,0,0,0,5
Industry Group / Groupe industriel:,4811,Scheduled air transportation,Transport aérien régulier,0,0,0,0,3,0,0,0,0,1,0,0,0,4
Industry / Industrie:,48111,Scheduled air transportation,Transport aérien régulier,0,0,0,0,3,0,0,0,0,1,0,0,0,4
National Industry / Industrie nationale:,481110,Scheduled air transportation,Transport aérien régulier,0,0,0,0,3,0,0,0,0,1,0,0,0,4
Industry Group / Groupe industriel:,4812,Non-scheduled air transportation,Transport aérien non régulier,0,0,0,0,1,0,0,0,0,0,0,0,0,1
Industry / Industrie:,48121,Non-scheduled air transportation,Transport aérien non régulier,0,0,0,0,1,0,0,0,0,0,0,0,0,1
National Industry / Industrie nationale:,481214,Non-scheduled chartered air transportation,Transport aérien d'affrètement non régulier,0,0,0,0,0,0,0,0,0,0,0,0,0,0
National Industry / Industrie nationale:,481215,Non-scheduled specialty flying services,Services de vols spécialisés non réguliers,0,0,0,0,1,0,0,0,0,0,0,0,0,1
Sub Sector / Sous-secteur:,482,Rail transportation,Transport ferroviaire,0,0,0,0,0,0,0,0,0,0,0,0,0,0
Industry Group / Groupe industriel:,4821,Rail transportation,Transport ferroviaire,0,0,0,0,0,0,0,0,0,0,0,0,0,0
Industry / Industrie:,48211,Rail transportation,Transport ferroviaire,0,0,0,0,0,0,0,0,0,0,0,0,0,0
National Industry / Industrie nationale:,482112,Short-haul freight rail transportation,Transport ferroviaire de marchandises sur de courtes distances,0,0,0,0,0,0,0,0,0,0,0,0,0,0
National Industry / Industrie nationale:,482113,Mainline freight rail transportation,Transport ferroviaire de marchandises sur ligne principale,0,0,0,0,0,0,0,0,0,0,0,0,0,0
National Industry / Industrie nationale:,482114,Passenger rail transportation,Transport ferroviaire de voyageurs,0,0,0,0,0,0,0,0,0,0,0,0,0,0
Sub Sector / Sous-secteur:,483,Water transportation,Transport par eau,0,0,0,0,0,0,0,0,0,0,0,0,0,0
Industry Group / Groupe industriel:,4831,"Deep sea, coastal and Great Lakes water transportation","Transport hauturier, côtier et sur les Grands Lacs",0,0,0,0,0,0,0,0,0,0,0,0,0,0
Industry / Industrie:,48311,"Deep sea, coastal and Great Lakes water transportation","Transport hauturier, côtier et sur les Grands Lacs",0,0,0,0,0,0,0,0,0,0,0,0,0,0
National Industry / Industrie nationale:,483115,"Deep sea, coastal and Great Lakes water transportation (except by ferries)","Transport hauturier, côtier et sur les Grands Lacs, sauf le transport par
traversier",0,0,0,0,0,0,0,0,0,0,0,0,0,0
National Industry / Industrie nationale:,483116,"Deep sea, coastal and Great Lakes water transportation by ferries","Transport hauturier, côtier et sur les Grands Lacs par traversier",0,0,0,0,0,0,0,0,0,0,0,0,0,0
Industry Group / Groupe industriel:,4832,Inland water transportation,Transport sur les eaux intérieures,0,0,0,0,0,0,0,0,0,0,0,0,0,0
Industry / Industrie:,48321,Inland water transportation,Transport sur les eaux intérieures,0,0,0,0,0,0,0,0,0,0,0,0,0,0
National Industry / Industrie nationale:,483213,Inland water transportation (except by ferries),Transport sur les eaux intérieures (sauf par traversier),0,0,0,0,0,0,0,0,0,0,0,0,0,0
