Office of the Superintendent of Bankruptcy,,,,,,,,,,,,,,,,,
Business Bankruptcy Statistics by the North American Industry Classification System by Province,,,,,,,,,,,,,,,,,
Year: 2024,,,,,,,,,,,,,,,,,
,,,,,,,,,,,,,,,,,
Bureau du surintendent des faillites,,,,,,,,,,,,,,,,,
Statistiques provinciales sur les faillites d'entreprise selon le Système de classification des industries de l'Amerique du Nord,,,,,,,,,,,,,,,,,
Année: 2024,,,,,,,,,,,,,,,,,
,,,,,,,,,,,,,,,,,
,,,,,,,,,,,,,,,,,
TYPE,CODE,TITLE,TITRE,"N.L 
T.-N.-L.","N.S. 
N.-É.","P.E.I. 
Î.-P.-É.","N.B. 
N.-B.","QUE. 
QC","ONT. 
ONT.","MAN. 
MAN.","SASK. 
SASK.","ALTA. 
ALB.","B.C. 
C.-B.","N.W.T. 
T.-N.-O.","Y.T. 
YUKON","NUN. 
NUN.","CANADA 
CANADA"
Sector / Secteur:,11,"Agriculture, forestry, fishing and hunting","Agriculture, foresterie, pêche et chasse",0,3,0,2,50,9,3,1,2,4,0,0,0,74
Sub Sector / Sous-secteur:,111,Crop production,Cultures agricoles,0,1,0,0,16,3,2,1,0,2,0,0,0,25
Industry Group / Groupe industriel:,1111,Oilseed and grain farming,Culture de plantes oléagineuses et de céréales,0,0,0,0,0,0,2,0,0,0,0,0,0,2
Industry / Industrie:,11111,Soybean farming,Culture du soja,0,0,0,0,0,0,0,0,0,0,0,0,0,0
National Industry / Industrie nationale:,111110,Soybean farming,Culture du soja,0,0,0,0,0,0,0,0,0,0,0,0,0,0
Industry / Industrie:,11112,Oilseed (except soybean) farming,Culture de plantes oléagineuses (sauf le soja),0,0,0,0,0,0,0,0,0,0,0,0,0,0
National Industry / Industrie nationale:,111120,Oilseed (except soybean) farming,Culture de plantes oléagineuses (sauf le soja),0,0,0,0,0,0,0,0,0,0,0,0,0,0
Industry / Industrie:,11113,Dry pea and bean farming,Culture de pois et de haricots secs,0,0,0,0,0,0,0,0,0,0,0,0,0,0
National Industry / Industrie nationale:,111130,Dry pea and bean farming,Culture de pois et de haricots secs,0,0,0,0,0,0,0,0,0,0,0,0,0,0
Industry / Industrie:,11114,Wheat farming,Culture du blé,0,0,0,0,0,0,2,0,0,0,0,0,0,2
National Industry / Industrie nationale:,111140,Wheat farming,Culture du blé,0,0,0,0,0,0,2,0,0,0,0,0,0,2
Industry / Industrie:,11115,Corn farming,Culture du maïs,0,0,0,0,0,0,0,0,0,0,0,0,0,0
National Industry / Industrie nationale:,111150,Corn farming,Culture du maïs,0,0,0,0,0,0,0,0,0,0,0,0,0,0
Industry / Industrie:,11116,Rice farming,Culture du riz,0,0,0,0,0,0,0,0,0,0,0,0,0,0
National Industry / Industrie nationale:,111160,Rice farming,Culture du riz,0,0,0,0,0,0,0,0,0,0,0,0,0,0
Industry / Industrie:,11119,Other grain farming,Autres cultures céréalières,0,0,0,0,0,0,0,0,0,0,0,0,0,0
National Industry / Industrie nationale:,111190,Other grain farming,Autres cultures céréalières,0,0,0,0,0,0,0,0,0,0,0,0,0,0
Industry Group / Groupe industriel:,1112,Vegetable and melon farming,Culture de légumes et de melons,0,1,0,0,3,0,0,0,0,0,0,0,0,4
Industry / Industrie:,11121,Vegetable and melon farming,Culture de légumes et de melons,0,1,0,0,3,0,0,0,0,0,0,0,0,4
National Industry / Industrie nationale:,111211,Potato farming,Culture de pommes de terre,0,0,0,0,0,0,0,0,0,0,0,0,0,0
National Industry / Industrie nationale:,111219,Other vegetable (except potato) and melon farming,Autres cultures de légumes et de melons (sauf de pommes de terre),0,1,0,0,3,0,0,0,0,0,0,0,0,4
Industry Group / Groupe industriel:,1113,Fruit and tree nut farming,Culture de fruits et de noix,0,0,0,0,0,2,0,0,0,1,0,0,0,3
Industry / Industrie:,11131,Orange groves,Culture d'oranges,0,0,0,0,0,0,0,0,0,0,0,0,0,0
National Industry / Industrie nationale:,111310,Orange groves,Culture d'oranges,0,0,0,0,0,0,0,0,0,0,0,0,0,0
Industry / Industrie:,11132,Citrus (except orange) groves,Culture d'agrumes (sauf les oranges),0,0,0,0,0,0,0,0,0,1,0,0,0,1
National Industry / Industrie nationale:,111320,Citrus (except orange) groves,Culture d'agrumes (sauf les oranges),0,0,0,0,0,0,0,0,0,1,0,0,0,1
Industry / Industrie:,11133,Non-citrus fruit and tree nut farming,Culture de noix et de fruits (sauf les agrumes),0,0,0,0,0,2,0,0,0,0,0,0,0,2
National Industry / Industrie nationale:,111330,Non-citrus fruit and tree nut farming,Culture de noix et de fruits (sauf les agrumes),0,0,0,0,0,2,0,0,0,0,0,0,0,2
Industry Group / Groupe industriel:,1114,"Greenhouse, nursery and floriculture production","Culture en serre et en pépinière, et floriculture",0,0,0,0,3,1,0,0,0,0,0,0,0,4
Industry / Industrie:,11141,Food crops grown under cover,Culture vivrière en serre,0,0,0,0,2,1,0,0,0,0,0,0,0,3
National Industry / Industrie nationale:,111411,Mushroom production,Culture de champignons,0,0,0,0,0,0,0,0,0,0,0,0,0,0
National Industry / Industrie nationale:,111412,Cannabis grown under cover,Culture de cannabis sous abri,0,0,0,0,1,1,0,0,0,0,0,0,0,2
National Industry / Industrie nationale:,111419,Other food crops grown under cover,Autres cultures vivrières en serre,0,0,0,0,1,0,0,0,0,0,0,0,0,1
Industry / Industrie:,11142,Nursery and floriculture production,Culture en pépinière et floriculture,0,0,0,0,1,0,0,0,0,0,0,0,0,1
National Industry / Industrie nationale:,111421,Nursery and tree production,Culture en pépinière et arboriculture,0,0,0,0,1,0,0,0,0,0,0,0,0,1
National Industry / Industrie nationale:,111422,Floriculture production,Floriculture,0,0,0,0,0,0,0,0,0,0,0,0,0,0
Industry Group / Groupe industriel:,1119,Other crop farming,Autres cultures agricoles,0,0,0,0,10,0,0,1,0,1,0,0,0,12
Industry / Industrie:,11191,Tobacco farming,Culture du tabac,0,0,0,0,0,0,0,0,0,0,0,0,0,0
National Industry / Industrie nationale:,111910,Tobacco farming,Culture du tabac,0,0,0,0,0,0,0,0,0,0,0,0,0,0
Industry / Industrie:,11192,Cotton farming,Culture du coton,0,0,0,0,0,0,0,0,0,0,0,0,0,0
National Industry / Industrie nationale:,111920,Cotton farming,Culture du coton,0,0,0,0,0,0,0,0,0,0,0,0,0,0
Industry / Industrie:,11193,Sugar cane farming,Culture de la canne à sucre,0,0,0,0,0,0,0,0,0,0,0,0,0,0
National Industry / Industrie nationale:,111930,Sugar cane farming,Culture de la canne à sucre,0,0,0,0,0,0,0,0,0,0,0,0,0,0
Industry / Industrie:,11194,Hay farming,Culture du foin,0,0,0,0,0,0,0,0,0,0,0,0,0,0
National Industry / Industrie nationale:,111940,Hay farming,Culture du foin,0,0,0,0,0,0,0,0,0,0,0,0,0,0
Industry / Industrie:,11199,All other crop farming,Toutes les autres cultures agricoles,0,0,0,0,10,0,0,1,0,1,0,0,0,12
National Industry / Industrie nationale:,111993,Fruit and vegetable combination farming,Culture mixte de fruits et de légumes,0,0,0,0,2,0,0,1,0,1,0,0,0,4
National Industry / Industrie nationale:,111994,Maple syrup and products production,Production de sirop d'érable et d'autres produits de l'érable,0,0,0,0,2,0,0,0,0,0,0,0,0,2
National Industry / Industrie nationale:,111995,Cannabis grown in open fields,Culture de cannabis en plein champ,0,0,0,0,0,0,0,0,0,0,0,0,0,0
National Industry / Industrie nationale:,111999,All other miscellaneous crop farming,Toutes les autres cultures agricoles diverses,0,0,0,0,6,0,0,0,0,0,0,0,0,6
Sub Sector / Sous-secteur:,112,Animal production and aquaculture,Élevage et aquaculture,0,0,0,1,8,2,0,0,0,0,0,0,0,11
Industry Group / Groupe industriel:,1121,Cattle ranching and farming,Élevage de bovins,0,0,0,1,1,2,0,0,0,0,0,0,0,4
Industry / Industrie:,11211,"Beef cattle ranching and farming, including feedlots","Élevage de bovins de boucherie, y compris l'exploitation de parcs
d'engraissement",0,0,0,0,1,1,0,0,0,0,0,0,0,2
National Industry / Industrie nationale:,112110,"Beef cattle ranching and farming, including feedlots","Élevage de bovins de boucherie, y compris l'exploitation de parcs
d'engraissement",0,0,0,0,1,1,0,0,0,0,0,0,0,2
Industry / Industrie:,11212,Dairy cattle and milk production,Élevage de bovins laitiers et production laitière,0,0,0,1,0,1,0,0,0,0,0,0,0,2
National Industry / Industrie nationale:,112120,Dairy cattle and milk production,Élevage de bovins laitiers et production laitière,0,0,0,1,0,1,0,0,0,0,0,0,0,2
Industry Group / Groupe industriel:,1122,Hog and pig farming,Élevage de porcs,0,0,0,0,0,0,0,0,0,0,0,0,0,0
Industry / Industrie:,11221,Hog and pig farming,Élevage de porcs,0,0,0,0,0,0,0,0,0,0,0,0,0,0
National Industry / Industrie nationale:,112210,Hog and pig farming,Élevage de porcs,0,0,0,0,0,0,0,0,0,0,0,0,0,0
Industry Group / Groupe industriel:,1123,Poultry and egg production,Élevage de volailles et production d'oeufs,0,0,0,0,1,0,0,0,0,0,0,0,0,1
Industry / Industrie:,11231,Chicken egg production,Production d'oeufs de poules,0,0,0,0,0,0,0,0,0,0,0,0,0,0
National Industry / Industrie nationale:,112310,Chicken egg production,Production d'oeufs de poules,0,0,0,0,0,0,0,0,0,0,0,0,0,0
Industry / Industrie:,11232,Broiler and other meat-type chicken production,Élevage de poulets à griller et d'autres volailles d'abattage,0,0,0,0,1,0,0,0,0,0,0,0,0,1
National Industry / Industrie nationale:,112320,Broiler and other meat-type chicken production,Élevage de poulets à griller et d'autres volailles d'abattage,0,0,0,0,1,0,0,0,0,0,0,0,0,1
Industry / Industrie:,11233,Turkey production,Élevage de dindons,0,0,0,0,0,0,0,0,0,0,0,0,0,0
National Industry / Industrie nationale:,112330,Turkey production,Élevage de dindons,0,0,0,0,0,0,0,0,0,0,0,0,0,0
Industry / Industrie:,11234,Poultry hatcheries,Couvoirs,0,0,0,0,0,0,0,0,0,0,0,0,0,0
National Industry / Industrie nationale:,112340,Poultry hatcheries,Couvoirs,0,0,0,0,0,0,0,0,0,0,0,0,0,0
Industry / Industrie:,11239,Other poultry production,Élevage d'autres volailles,0,0,0,0,0,0,0,0,0,0,0,0,0,0
National Industry / Industrie nationale:,112391,Combination poultry and egg production,Élevage de volailles combiné à la production d'oeufs,0,0,0,0,0,0,0,0,0,0,0,0,0,0
National Industry / Industrie nationale:,112399,All other poultry production,Élevage de toutes autres volailles,0,0,0,0,0,0,0,0,0,0,0,0,0,0
Industry Group / Groupe industriel:,1124,Sheep and goat farming,Élevage de moutons et de chèvres,0,0,0,0,0,0,0,0,0,0,0,0,0,0
Industry / Industrie:,11241,Sheep farming,Élevage de moutons,0,0,0,0,0,0,0,0,0,0,0,0,0,0
National Industry / Industrie nationale:,112410,Sheep farming,Élevage de moutons,0,0,0,0,0,0,0,0,0,0,0,0,0,0
Industry / Industrie:,11242,Goat farming,Élevage de chèvres,0,0,0,0,0,0,0,0,0,0,0,0,0,0
National Industry / Industrie nationale:,112420,Goat farming,Élevage de chèvres,0,0,0,0,0,0,0,0,0,0,0,0,0,0
Industry Group / Groupe industriel:,1125,Aquaculture,Aquaculture,0,0,0,0,3,0,0,0,0,0,0,0,0,3
Industry / Industrie:,11251,Aquaculture,Aquaculture,0,0,0,0,3,0,0,0,0,0,0,0,0,3
National Industry / Industrie nationale:,112510,Aquaculture,Aquaculture,0,0,0,0,3,0,0,0,0,0,0,0,0,3
Industry Group / Groupe industriel:,1129,Other animal production,Autres types d'élevage,0,0,0,0,3,0,0,0,0,0,0,0,0,3
Industry / Industrie:,11291,Apiculture,Apiculture,0,0,0,0,0,0,0,0,0,0,0,0,0,0
National Industry / Industrie nationale:,112910,Apiculture,Apiculture,0,0,0,0,0,0,0,0,0,0,0,0,0,0
Industry / Industrie:,11292,Horse and other equine production,Élevage de chevaux et d'autres équidés,0,0,0,0,1,0,0,0,0,0,0,0,0,1
National Industry / Industrie nationale:,112920,Horse and other equine production,Élevage de chevaux et d'autres équidés,0,0,0,0,1,0,0,0,0,0,0,0,0,1
Industry / Industrie:,11293,Fur-bearing animal and rabbit production,Élevage d'animaux à fourrure et de lapins,0,0,0,0,0,0,0,0,0,0,0,0,0,0
National Industry / Industrie nationale:,112930,Fur-bearing animal and rabbit production,Élevage d'animaux à fourrure et de lapins,0,0,0,0,0,0,0,0,0,0,0,0,0,0
Industry / Industrie:,11299,All other animal production,Tous les autres types d'élevage,0,0,0,0,2,0,0,0,0,0,0,0,0,2
National Industry / Industrie nationale:,112991,Animal combination farming,Élevage mixte d'animaux,0,0,0,0,1,0,0,0,0,0,0,0,0,1
National Industry / Industrie nationale:,112999,All other miscellaneous animal production,Tous les autres types d'élevage divers,0,0,0,0,1,0,0,0,0,0,0,0,0,1
Sub Sector / Sous-secteur:,113,Forestry and logging,Foresterie et exploitation forestière,0,0,0,1,11,2,0,0,0,1,0,0,0,15
Industry Group / Groupe industriel:,1131,Timber tract operations,Exploitation de terres à bois,0,0,0,0,0,0,0,0,0,0,0,0,0,0
Industry / Industrie:,11311,Timber tract operations,Exploitation de terres à bois,0,0,0,0,0,0,0,0,0,0,0,0,0,0
National Industry / Industrie nationale:,113110,Timber tract operations,Exploitation de terres à bois,0,0,0,0,0,0,0,0,0,0,0,0,0,0
Industry Group / Groupe industriel:,1132,Forest nurseries and gathering of forest products,Pépinières forestières et récolte de produits forestiers,0,0,0,0,1,0,0,0,0,0,0,0,0,1
Industry / Industrie:,11321,Forest nurseries and gathering of forest products,Pépinières forestières et récolte de produits forestiers,0,0,0,0,1,0,0,0,0,0,0,0,0,1
National Industry / Industrie nationale:,113210,Forest nurseries and gathering of forest products,Pépinières forestières et récolte de produits forestiers,0,0,0,0,1,0,0,0,0,0,0,0,0,1
Industry Group / Groupe industriel:,1133,Logging,Exploitation forestière,0,0,0,1,10,2,0,0,0,1,0,0,0,14
Industry / Industrie:,11331,Logging,Exploitation forestière,0,0,0,1,10,2,0,0,0,1,0,0,0,14
National Industry / Industrie nationale:,113311,Logging (except contract),Exploitation forestière (sauf à forfait),0,0,0,1,9,1,0,0,0,1,0,0,0,12
National Industry / Industrie nationale:,113312,Contract logging,Exploitation forestière à forfait,0,0,0,0,1,1,0,0,0,0,0,0,0,2
Sub Sector / Sous-secteur:,114,"Fishing, hunting and trapping","Pêche, chasse et piégeage",0,0,0,0,2,0,0,0,0,1,0,0,0,3
Industry Group / Groupe industriel:,1141,Fishing,Pêche,0,0,0,0,2,0,0,0,0,0,0,0,0,2
Industry / Industrie:,11411,Fishing,Pêche,0,0,0,0,2,0,0,0,0,0,0,0,0,2
National Industry / Industrie nationale:,114113,Salt water fishing,Pêche en eau salée,0,0,0,0,1,0,0,0,0,0,0,0,0,1
National Industry / Industrie nationale:,114114,Freshwater fishing,Pêche en eau douce,0,0,0,0,1,0,0,0,0,0,0,0,0,1
Industry Group / Groupe industriel:,1142,Hunting and trapping,Chasse et piégeage,0,0,0,0,0,0,0,0,0,1,0,0,0,1
Industry / Industrie:,11421,Hunting and trapping,Chasse et piégeage,0,0,0,0,0,0,0,0,0,1,0,0,0,1
National Industry / Industrie nationale:,114210,Hunting and trapping,Chasse et piégeage,0,0,0,0,0,0,0,0,0,1,0,0,0,1
Sub Sector / Sous-secteur:,115,Support activities for agriculture and forestry,Activités de soutien à l'agriculture et à la foresterie,0,2,0,0,13,2,1,0,2,0,0,0,0,20
Industry Group / Groupe industriel:,1151,Support activities for crop production,Activités de soutien aux cultures agricoles,0,0,0,0,3,0,1,0,2,0,0,0,0,6
Industry / Industrie:,11511,Support activities for crop production,Activités de soutien aux cultures agricoles,0,0,0,0,3,0,1,0,2,0,0,0,0,6
National Industry / Industrie nationale:,115110,Support activities for crop production,Activités de soutien aux cultures agricoles,0,0,0,0,3,0,1,0,2,0,0,0,0,6
Industry Group / Groupe industriel:,1152,Support activities for animal production,Activités de soutien à l'élevage,0,0,0,0,1,0,0,0,0,0,0,0,0,1
Industry / Industrie:,11521,Support activities for animal production,Activités de soutien à l'élevage,0,0,0,0,1,0,0,0,0,0,0,0,0,1
National Industry / Industrie nationale:,115210,Support activities for animal production,Activités de soutien à l'élevage,0,0,0,0,1,0,0,0,0,0,0,0,0,1
Industry Group / Groupe industriel:,1153,Support activities for forestry,Activités de soutien à la foresterie,0,2,0,0,9,2,0,0,0,0,0,0,0,13
Industry / Industrie:,11531,Support activities for forestry,Activités de soutien à la foresterie,0,2,0,0,9,2,0,0,0,0,0,0,0,13
National Industry / Industrie nationale:,115310,Support activities for forestry,Activités de soutien à la foresterie,0,2,0,0,9,2,0,0,0,0,0,0,0,13
Sector / Secteur:,21,"Mining, quarrying, and oil and gas extraction","Extraction minière, exploitation en carrière, et extraction de pétrole et de gaz",0,0,0,0,3,6,0,1,4,2,0,0,0,16
Sub Sector / Sous-secteur:,211,Oil and gas extraction,Extraction de pétrole et de gaz,0,0,0,0,0,0,0,1,0,0,0,0,0,1
Industry Group / Groupe industriel:,2111,Oil and gas extraction,Extraction de pétrole et de gaz,0,0,0,0,0,0,0,1,0,0,0,0,0,1
Industry / Industrie:,21111,Oil and gas extraction (except oil sands),Extraction de pétrole et de gaz (à l'exception des sables bitumineux),0,0,0,0,0,0,0,1,0,0,0,0,0,1
National Industry / Industrie nationale:,211110,Oil and gas extraction (except oil sands),Extraction de pétrole et de gaz (à l'exception des sables bitumineux),0,0,0,0,0,0,0,1,0,0,0,0,0,1
Industry / Industrie:,21114,Oil sands extraction,Extraction de sables bitumineux,0,0,0,0,0,0,0,0,0,0,0,0,0,0
National Industry / Industrie nationale:,211141,In-situ oil sands extraction,Extraction in situ de sables bitumineux,0,0,0,0,0,0,0,0,0,0,0,0,0,0
National Industry / Industrie nationale:,211142,Mined oil sands extraction,Extraction minière de sables bitumineux,0,0,0,0,0,0,0,0,0,0,0,0,0,0
Sub Sector / Sous-secteur:,212,Mining and quarrying (except oil and gas),"Extraction minière et exploitation en carrière (sauf l'extraction de pétrole et
de gaz)",0,0,0,0,2,3,0,0,1,1,0,0,0,7
Industry Group / Groupe industriel:,2121,Coal mining,Extraction de charbon,0,0,0,0,0,1,0,0,0,0,0,0,0,1
Industry / Industrie:,21211,Coal mining,Extraction de charbon,0,0,0,0,0,1,0,0,0,0,0,0,0,1
National Industry / Industrie nationale:,212114,Bituminous coal mining,Extraction de charbon bitumineux,0,0,0,0,0,0,0,0,0,0,0,0,0,0
National Industry / Industrie nationale:,212115,Subbituminous coal mining,Extraction de charbon subbitumineux,0,0,0,0,0,0,0,0,0,0,0,0,0,0
National Industry / Industrie nationale:,212116,Lignite coal mining,Extraction de charbon de lignite,0,0,0,0,0,1,0,0,0,0,0,0,0,1
Industry Group / Groupe industriel:,2122,Metal ore mining,Extraction de minerais métalliques,0,0,0,0,0,0,0,0,0,0,0,0,0,0
Industry / Industrie:,21221,Iron ore mining,Extraction de minerais de fer,0,0,0,0,0,0,0,0,0,0,0,0,0,0
National Industry / Industrie nationale:,212210,Iron ore mining,Extraction de minerais de fer,0,0,0,0,0,0,0,0,0,0,0,0,0,0
Industry / Industrie:,21222,Gold and silver ore mining,Extraction de minerais d'or et d'argent,0,0,0,0,0,0,0,0,0,0,0,0,0,0
National Industry / Industrie nationale:,212220,Gold and silver ore mining,Extraction de minerais d'or et d'argent,0,0,0,0,0,0,0,0,0,0,0,0,0,0
Industry / Industrie:,21223,"Copper, nickel, lead and zinc ore mining","Extraction de minerais de cuivre, de nickel, de plomb et de zinc",0,0,0,0,0,0,0,0,0,0,0,0,0,0
National Industry / Industrie nationale:,212231,Lead-zinc ore mining,Extraction de minerais de plomb-zinc,0,0,0,0,0,0,0,0,0,0,0,0,0,0
National Industry / Industrie nationale:,212232,Nickel-copper ore mining,Extraction de minerais de nickel-cuivre,0,0,0,0,0,0,0,0,0,0,0,0,0,0
National Industry / Industrie nationale:,212233,Copper-zinc ore mining,Extraction de minerais de cuivre-zinc,0,0,0,0,0,0,0,0,0,0,0,0,0,0
Industry / Industrie:,21229,Other metal ore mining,Extraction d'autres minerais métalliques,0,0,0,0,0,0,0,0,0,0,0,0,0,0
National Industry / Industrie nationale:,212291,Uranium ore mining,Extraction de minerais d'uranium,0,0,0,0,0,0,0,0,0,0,0,0,0,0
National Industry / Industrie nationale:,212299,All other metal ore mining,Extraction de tous les autres minerais métalliques,0,0,0,0,0,0,0,0,0,0,0,0,0,0
Industry Group / Groupe industriel:,2123,Non-metallic mineral mining and quarrying,Extraction de minerais non métalliques,0,0,0,0,2,2,0,0,1,1,0,0,0,6
Industry / Industrie:,21231,Stone mining and quarrying,Extraction de pierre,0,0,0,0,0,2,0,0,0,0,0,0,0,2
National Industry / Industrie nationale:,212314,Granite mining and quarrying,Extraction de granite,0,0,0,0,0,1,0,0,0,0,0,0,0,1
National Industry / Industrie nationale:,212315,Limestone mining and quarrying,Extraction de calcaire,0,0,0,0,0,1,0,0,0,0,0,0,0,1
National Industry / Industrie nationale:,212316,Marble mining and quarrying,Extraction de marbre,0,0,0,0,0,0,0,0,0,0,0,0,0,0
National Industry / Industrie nationale:,212317,Sandstone mining and quarrying,Extraction de grès,0,0,0,0,0,0,0,0,0,0,0,0,0,0
Industry / Industrie:,21232,"Sand, gravel, clay, and ceramic and refractory minerals mining and
quarrying","Extraction de sable, de gravier, d'argile, de céramique et de minerais
réfractaires",0,0,0,0,1,0,0,0,1,0,0,0,0,2
National Industry / Industrie nationale:,212323,Sand and gravel mining and quarrying,Extraction de sable et de gravier,0,0,0,0,1,0,0,0,1,0,0,0,0,2
National Industry / Industrie nationale:,212326,"Shale, clay and refractory mineral mining and quarrying","Extraction de schiste, d'argile et de minerais réfractaires",0,0,0,0,0,0,0,0,0,0,0,0,0,0
Industry / Industrie:,21239,Other non-metallic mineral mining and quarrying,Extraction d'autres minerais non métalliques,0,0,0,0,1,0,0,0,0,1,0,0,0,2
National Industry / Industrie nationale:,212392,Diamond mining,Extraction de diamant,0,0,0,0,0,0,0,0,0,0,0,0,0,0
National Industry / Industrie nationale:,212393,Salt mining,Extraction de sel,0,0,0,0,0,0,0,0,0,0,0,0,0,0
National Industry / Industrie nationale:,212394,Asbestos mining,Extraction d'amiante,0,0,0,0,1,0,0,0,0,0,0,0,0,1
National Industry / Industrie nationale:,212395,Gypsum mining,Extraction de gypse,0,0,0,0,0,0,0,0,0,0,0,0,0,0
National Industry / Industrie nationale:,212396,Potash mining,Extraction de potasse,0,0,0,0,0,0,0,0,0,0,0,0,0,0
National Industry / Industrie nationale:,212397,Peat extraction,Extraction de tourbe,0,0,0,0,0,0,0,0,0,0,0,0,0,0
National Industry / Industrie nationale:,212398,All other non-metallic mineral mining and quarrying,Extraction de tous les autres minerais non métalliques,0,0,0,0,0,0,0,0,0,1,0,0,0,1
Sub Sector / Sous-secteur:,213,"Support activities for mining, and oil and gas extraction","Activités de soutien à l'extraction minière, pétrolière et gazière",0,0,0,0,1,3,0,0,3,1,0,0,0,8
Industry Group / Groupe industriel:,2131,"Support activities for mining, and oil and gas extraction","Activités de soutien à l'extraction minière, pétrolière et gazière",0,0,0,0,1,3,0,0,3,1,0,0,0,8
Industry / Industrie:,21311,"Support activities for mining, and oil and gas extraction","Activités de soutien à l'extraction minière, pétrolière et gazière",0,0,0,0,1,3,0,0,3,1,0,0,0,8
National Industry / Industrie nationale:,213111,Oil and gas contract drilling,Forage à forfait de puits de pétrole et de gaz,0,0,0,0,0,0,0,0,2,0,0,0,0,2
National Industry / Industrie nationale:,213117,Contract drilling (except oil and gas),Forage à forfait (sauf de puits de pétrole et de gaz),0,0,0,0,0,3,0,0,0,0,0,0,0,3
National Industry / Industrie nationale:,213118,Services to oil and gas extraction,Services relatifs à l'extraction de pétrole et de gaz,0,0,0,0,0,0,0,0,1,0,0,0,0,1
National Industry / Industrie nationale:,213119,Other support activities for mining,Autres activités de soutien à l'extraction minière,0,0,0,0,1,0,0,0,0,1,0,0,0,2
Sector / Secteur:,22,Utilities,Services publics,0,1,0,0,3,3,0,0,0,2,0,0,0,9
Sub Sector / Sous-secteur:,221,Utilities,Services publics,0,1,0,0,3,3,0,0,0,2,0,0,0,9
Industry Group / Groupe industriel:,2211,"Electric power generation, transmission and distribution","Production, transport et distribution d'électricité",0,1,0,0,3,3,0,0,0,0,0,0,0,7
Industry / Industrie:,22111,Electric power generation,Production d'électricité,0,1,0,0,3,1,0,0,0,0,0,0,0,5
National Industry / Industrie nationale:,221111,Hydro-electric power generation,Production d'hydroélectricité,0,0,0,0,0,0,0,0,0,0,0,0,0,0
National Industry / Industrie nationale:,221112,Fossil-fuel electric power generation,Production d'électricité à partir de combustibles fossiles,0,0,0,0,0,0,0,0,0,0,0,0,0,0
National Industry / Industrie nationale:,221113,Nuclear electric power generation,Production d'électricité d'origine nucléaire,0,0,0,0,0,0,0,0,0,0,0,0,0,0
National Industry / Industrie nationale:,221119,Other electric power generation,Autres activités de production d'électricité,0,1,0,0,3,1,0,0,0,0,0,0,0,5
Industry / Industrie:,22112,"Electric power transmission, control and distribution","Transport, gestion et distribution d'électricité",0,0,0,0,0,2,0,0,0,0,0,0,0,2
National Industry / Industrie nationale:,221121,Electric bulk power transmission and control,Transport et gestion d'électricité en bloc,0,0,0,0,0,0,0,0,0,0,0,0,0,0
National Industry / Industrie nationale:,221122,Electric power distribution,Distribution d'électricité,0,0,0,0,0,2,0,0,0,0,0,0,0,2
Industry Group / Groupe industriel:,2212,Natural gas distribution,Distribution de gaz naturel,0,0,0,0,0,0,0,0,0,0,0,0,0,0
Industry / Industrie:,22121,Natural gas distribution,Distribution de gaz naturel,0,0,0,0,0,0,0,0,0,0,0,0,0,0
National Industry / Industrie nationale:,221210,Natural gas distribution,Distribution de gaz naturel,0,0,0,0,0,0,0,0,0,0,0,0,0,0
Industry Group / Groupe industriel:,2213,"Water, sewage and other systems",Réseaux d'aqueduc et d'égout et autres,0,0,0,0,0,0,0,0,0,2,0,0,0,2
Industry / Industrie:,22131,Water supply and irrigation systems,Réseaux d'aqueduc et systèmes d'irrigation,0,0,0,0,0,0,0,0,0,2,0,0,0,2
National Industry / Industrie nationale:,221310,Water supply and irrigation systems,Réseaux d'aqueduc et systèmes d'irrigation,0,0,0,0,0,0,0,0,0,2,0,0,0,2
Industry / Industrie:,22132,Sewage treatment facilities,Installations d'épuration des eaux usées,0,0,0,0,0,0,0,0,0,0,0,0,0,0
National Industry / Industrie nationale:,221320,Sewage treatment facilities,Installations d'épuration des eaux usées,0,0,0,0,0,0,0,0,0,0,0,0,0,0
Industry / Industrie:,22133,Steam and air-conditioning supply,Production de vapeur et conditionnement de l'air,0,0,0,0,0,0,0,0,0,0,0,0,0,0
National Industry / Industrie nationale:,221330,Steam and air-conditioning supply,Production de vapeur et conditionnement de l'air,0,0,0,0,0,0,0,0,0,0,0,0,0,0
Sector / Secteur:,23,Construction,Construction,4,6,2,3,347,207,5,6,28,29,0,0,0,637
Sub Sector / Sous-secteur:,236,Construction of buildings,Construction de bâtiments,0,4,0,1,176,79,1,3,12,13,0,0,0,289
Industry Group / Groupe industriel:,2361,Residential building construction,Construction résidentielle,0,4,0,1,167,67,1,3,10,11,0,0,0,264
