National Industry / Industrie nationale:,327120,Clay building material and refractory manufacturing,Fabrication de matériaux de construction en argile et de produits réfractaires,0,0,0,0,0,0,0,0,0,0,0,0,0,0
Industry Group / Groupe industriel:,3272,Glass and glass product manufacturing,Fabrication de verre et de produits en verre,0,0,0,0,2,0,0,0,0,0,0,0,0,2
Industry / Industrie:,32721,Glass and glass product manufacturing,Fabrication de verre et de produits en verre,0,0,0,0,2,0,0,0,0,0,0,0,0,2
National Industry / Industrie nationale:,327214,Glass manufacturing,Fabrication de verre,0,0,0,0,1,0,0,0,0,0,0,0,0,1
National Industry / Industrie nationale:,327215,Glass product manufacturing from purchased glass,Fabrication de produits en verre à partir de verre acheté,0,0,0,0,1,0,0,0,0,0,0,0,0,1
Industry Group / Groupe industriel:,3273,Cement and concrete product manufacturing,Fabrication de ciment et de produits en béton,0,0,0,0,2,2,0,0,0,0,0,0,0,4
Industry / Industrie:,32731,Cement manufacturing,Fabrication de ciment,0,0,0,0,0,1,0,0,0,0,0,0,0,1
National Industry / Industrie nationale:,327310,Cement manufacturing,Fabrication de ciment,0,0,0,0,0,1,0,0,0,0,0,0,0,1
Industry / Industrie:,32732,Ready-mix concrete manufacturing,Fabrication de béton préparé,0,0,0,0,0,0,0,0,0,0,0,0,0,0
National Industry / Industrie nationale:,327320,Ready-mix concrete manufacturing,Fabrication de béton préparé,0,0,0,0,0,0,0,0,0,0,0,0,0,0
Industry / Industrie:,32733,"Concrete pipe, brick and block manufacturing","Fabrication de tuyaux, briques et blocs en béton",0,0,0,0,0,0,0,0,0,0,0,0,0,0
National Industry / Industrie nationale:,327330,"Concrete pipe, brick and block manufacturing","Fabrication de tuyaux, briques et blocs en béton",0,0,0,0,0,0,0,0,0,0,0,0,0,0
Industry / Industrie:,32739,Other concrete product manufacturing,Fabrication d'autres produits en béton,0,0,0,0,2,1,0,0,0,0,0,0,0,3
National Industry / Industrie nationale:,327390,Other concrete product manufacturing,Fabrication d'autres produits en béton,0,0,0,0,2,1,0,0,0,0,0,0,0,3
Industry Group / Groupe industriel:,3274,Lime and gypsum product manufacturing,Fabrication de chaux et de produits en gypse,0,0,0,0,0,0,0,0,0,0,0,0,0,0
Industry / Industrie:,32741,Lime manufacturing,Fabrication de chaux,0,0,0,0,0,0,0,0,0,0,0,0,0,0
National Industry / Industrie nationale:,327410,Lime manufacturing,Fabrication de chaux,0,0,0,0,0,0,0,0,0,0,0,0,0,0
Industry / Industrie:,32742,Gypsum product manufacturing,Fabrication de produits en gypse,0,0,0,0,0,0,0,0,0,0,0,0,0,0
National Industry / Industrie nationale:,327420,Gypsum product manufacturing,Fabrication de produits en gypse,0,0,0,0,0,0,0,0,0,0,0,0,0,0
Industry Group / Groupe industriel:,3279,Other non-metallic mineral product manufacturing,Fabrication d'autres produits minéraux non métalliques,0,0,0,0,2,1,0,0,0,0,0,0,0,3
Industry / Industrie:,32791,Abrasive product manufacturing,Fabrication de produits abrasifs,0,0,0,0,1,0,0,0,0,0,0,0,0,1
National Industry / Industrie nationale:,327910,Abrasive product manufacturing,Fabrication de produits abrasifs,0,0,0,0,1,0,0,0,0,0,0,0,0,1
Industry / Industrie:,32799,All other non-metallic mineral product manufacturing,Fabrication de tous les autres produits minéraux non métalliques,0,0,0,0,1,1,0,0,0,0,0,0,0,2
National Industry / Industrie nationale:,327990,All other non-metallic mineral product manufacturing,Fabrication de tous les autres produits minéraux non métalliques,0,0,0,0,1,1,0,0,0,0,0,0,0,2
Sector / Secteur:,33,Manufacturing,Fabrication,0,2,0,2,69,62,0,1,9,9,0,0,0,154
Sub Sector / Sous-secteur:,331,Primary metal manufacturing,Première transformation des métaux,0,0,0,0,1,3,0,0,0,0,0,0,0,4
Industry Group / Groupe industriel:,3311,Iron and steel mills and ferro-alloy manufacturing,Sidérurgie,0,0,0,0,0,0,0,0,0,0,0,0,0,0
Industry / Industrie:,33111,Iron and steel mills and ferro-alloy manufacturing,Sidérurgie,0,0,0,0,0,0,0,0,0,0,0,0,0,0
National Industry / Industrie nationale:,331110,Iron and steel mills and ferro-alloy manufacturing,Sidérurgie,0,0,0,0,0,0,0,0,0,0,0,0,0,0
Industry Group / Groupe industriel:,3312,Steel product manufacturing from purchased steel,Fabrication de produits en acier à partir d'acier acheté,0,0,0,0,0,1,0,0,0,0,0,0,0,1
Industry / Industrie:,33121,Iron and steel pipes and tubes manufacturing from purchased steel,Fabrication de tubes et de tuyaux en fer et en acier à partir d'acier acheté,0,0,0,0,0,1,0,0,0,0,0,0,0,1
National Industry / Industrie nationale:,331210,Iron and steel pipes and tubes manufacturing from purchased steel,Fabrication de tubes et de tuyaux en fer et en acier à partir d'acier acheté,0,0,0,0,0,1,0,0,0,0,0,0,0,1
Industry / Industrie:,33122,Rolling and drawing of purchased steel,Laminage et étirage d'acier acheté,0,0,0,0,0,0,0,0,0,0,0,0,0,0
National Industry / Industrie nationale:,331221,Cold-rolled steel shape manufacturing,Fabrication de formes en acier laminé à froid,0,0,0,0,0,0,0,0,0,0,0,0,0,0
National Industry / Industrie nationale:,331222,Steel wire drawing,Étirage de fils d'acier,0,0,0,0,0,0,0,0,0,0,0,0,0,0
Industry Group / Groupe industriel:,3313,Alumina and aluminum production and processing,Production et transformation d'alumine et d'aluminium,0,0,0,0,1,1,0,0,0,0,0,0,0,2
Industry / Industrie:,33131,Alumina and aluminum production and processing,Production et transformation d'alumine et d'aluminium,0,0,0,0,1,1,0,0,0,0,0,0,0,2
National Industry / Industrie nationale:,331313,Primary production of alumina and aluminum,Production primaire d'alumine et d'aluminium,0,0,0,0,0,1,0,0,0,0,0,0,0,1
National Industry / Industrie nationale:,331317,"Aluminum rolling, drawing, extruding and alloying","Laminage, étirage, extrusion et alliage de l'aluminium",0,0,0,0,1,0,0,0,0,0,0,0,0,1
Industry Group / Groupe industriel:,3314,Non-ferrous metal (except aluminum) production and processing,Production et transformation de métaux non ferreux (sauf l'aluminium),0,0,0,0,0,1,0,0,0,0,0,0,0,1
Industry / Industrie:,33141,Non-ferrous metal (except aluminum) smelting and refining,Fonte et affinage de métaux non ferreux (sauf l'aluminium),0,0,0,0,0,0,0,0,0,0,0,0,0,0
National Industry / Industrie nationale:,331410,Non-ferrous metal (except aluminum) smelting and refining,Fonte et affinage de métaux non ferreux (sauf l'aluminium),0,0,0,0,0,0,0,0,0,0,0,0,0,0
Industry / Industrie:,33142,"Copper rolling, drawing, extruding and alloying","Laminage, étirage, extrusion et alliage du cuivre",0,0,0,0,0,1,0,0,0,0,0,0,0,1
National Industry / Industrie nationale:,331420,"Copper rolling, drawing, extruding and alloying","Laminage, étirage, extrusion et alliage du cuivre",0,0,0,0,0,1,0,0,0,0,0,0,0,1
Industry / Industrie:,33149,"Non-ferrous metal (except copper and aluminum) rolling, drawing, extruding
and alloying","Laminage, étirage, extrusion et alliage de métaux non ferreux (sauf le cuivre
et l'aluminium)",0,0,0,0,0,0,0,0,0,0,0,0,0,0
National Industry / Industrie nationale:,331490,"Non-ferrous metal (except copper and aluminum) rolling, drawing, extruding
and alloying","Laminage, étirage, extrusion et alliage de métaux non ferreux (sauf le cuivre
et l'aluminium)",0,0,0,0,0,0,0,0,0,0,0,0,0,0
Industry Group / Groupe industriel:,3315,Foundries,Fonderies,0,0,0,0,0,0,0,0,0,0,0,0,0,0
Industry / Industrie:,33151,Ferrous metal foundries,Fonderies de métaux ferreux,0,0,0,0,0,0,0,0,0,0,0,0,0,0
National Industry / Industrie nationale:,331511,Iron foundries,Fonderies de fer,0,0,0,0,0,0,0,0,0,0,0,0,0,0
National Industry / Industrie nationale:,331514,Steel foundries,Fonderies d'acier,0,0,0,0,0,0,0,0,0,0,0,0,0,0
Industry / Industrie:,33152,Non-ferrous metal foundries,Fonderies de métaux non ferreux,0,0,0,0,0,0,0,0,0,0,0,0,0,0
National Industry / Industrie nationale:,331523,Non-ferrous metal die-casting foundries,"Fonderies de métaux non ferreux, moulage sous pression",0,0,0,0,0,0,0,0,0,0,0,0,0,0
National Industry / Industrie nationale:,331529,Non-ferrous metal foundries (except die-casting),Fonderies de métaux non ferreux (sauf moulage sous pression),0,0,0,0,0,0,0,0,0,0,0,0,0,0
Sub Sector / Sous-secteur:,332,Fabricated metal product manufacturing,Fabrication de produits métalliques,0,0,0,0,18,9,0,0,3,1,0,0,0,31
Industry Group / Groupe industriel:,3321,Forging and stamping,Forgeage et estampage,0,0,0,0,0,0,0,0,0,0,0,0,0,0
Industry / Industrie:,33211,Forging and stamping,Forgeage et estampage,0,0,0,0,0,0,0,0,0,0,0,0,0,0
National Industry / Industrie nationale:,332113,Forging,Forgeage,0,0,0,0,0,0,0,0,0,0,0,0,0,0
National Industry / Industrie nationale:,332118,Stamping,Estampage,0,0,0,0,0,0,0,0,0,0,0,0,0,0
Industry Group / Groupe industriel:,3322,Cutlery and hand tool manufacturing,Fabrication de coutellerie et d'outils à main,0,0,0,0,0,2,0,0,0,0,0,0,0,2
Industry / Industrie:,33221,Cutlery and hand tool manufacturing,Fabrication de coutellerie et d'outils à main,0,0,0,0,0,2,0,0,0,0,0,0,0,2
National Industry / Industrie nationale:,332210,Cutlery and hand tool manufacturing,Fabrication de coutellerie et d'outils à main,0,0,0,0,0,2,0,0,0,0,0,0,0,2
Industry Group / Groupe industriel:,3323,Architectural and structural metals manufacturing,"Fabrication de produits d'architecture et d'éléments de charpentes
métalliques",0,0,0,0,7,3,0,0,0,0,0,0,0,10
Industry / Industrie:,33231,Plate work and fabricated structural product manufacturing,Fabrication de tôles fortes et d'éléments de charpentes,0,0,0,0,0,1,0,0,0,0,0,0,0,1
National Industry / Industrie nationale:,332311,Prefabricated metal building and component manufacturing,Préfabrication de bâtiments en métal et de leurs composants,0,0,0,0,0,0,0,0,0,0,0,0,0,0
National Industry / Industrie nationale:,332314,Concrete reinforcing bar manufacturing,Fabrication de barres pour béton armé,0,0,0,0,0,0,0,0,0,0,0,0,0,0
National Industry / Industrie nationale:,332319,Other plate work and fabricated structural product manufacturing,Fabrication d'autres tôles fortes et éléments de charpentes,0,0,0,0,0,1,0,0,0,0,0,0,0,1
Industry / Industrie:,33232,Ornamental and architectural metal product manufacturing,Fabrication de produits métalliques d'ornement et d'architecture,0,0,0,0,7,2,0,0,0,0,0,0,0,9
National Industry / Industrie nationale:,332321,Metal window and door manufacturing,Fabrication de portes et de fenêtres en métal,0,0,0,0,2,2,0,0,0,0,0,0,0,4
National Industry / Industrie nationale:,332329,Other ornamental and architectural metal product manufacturing,Fabrication d'autres produits métalliques d'ornement et d'architecture,0,0,0,0,5,0,0,0,0,0,0,0,0,5
Industry Group / Groupe industriel:,3324,"Boiler, tank and shipping container manufacturing","Fabrication de chaudières, de réservoirs et de contenants d'expédition",0,0,0,0,0,0,0,0,0,0,0,0,0,0
Industry / Industrie:,33241,Power boiler and heat exchanger manufacturing,Fabrication de chaudières et d'échangeurs de chaleur,0,0,0,0,0,0,0,0,0,0,0,0,0,0
National Industry / Industrie nationale:,332410,Power boiler and heat exchanger manufacturing,Fabrication de chaudières et d'échangeurs de chaleur,0,0,0,0,0,0,0,0,0,0,0,0,0,0
Industry / Industrie:,33242,Metal tank (heavy gauge) manufacturing,Fabrication de réservoirs en métal (épais),0,0,0,0,0,0,0,0,0,0,0,0,0,0
National Industry / Industrie nationale:,332420,Metal tank (heavy gauge) manufacturing,Fabrication de réservoirs en métal (épais),0,0,0,0,0,0,0,0,0,0,0,0,0,0
Industry / Industrie:,33243,"Metal can, box and other metal container (light gauge) manufacturing","Fabrication de canettes, de boîtes et d'autres contenants en métal (mince)",0,0,0,0,0,0,0,0,0,0,0,0,0,0
National Industry / Industrie nationale:,332431,Metal can manufacturing,Fabrication de canettes,0,0,0,0,0,0,0,0,0,0,0,0,0,0
National Industry / Industrie nationale:,332439,Other metal container manufacturing,Fabrication d'autres contenants en métal,0,0,0,0,0,0,0,0,0,0,0,0,0,0
Industry Group / Groupe industriel:,3325,Hardware manufacturing,Fabrication d'articles de quincaillerie,0,0,0,0,0,0,0,0,0,0,0,0,0,0
Industry / Industrie:,33251,Hardware manufacturing,Fabrication d'articles de quincaillerie,0,0,0,0,0,0,0,0,0,0,0,0,0,0
National Industry / Industrie nationale:,332510,Hardware manufacturing,Fabrication d'articles de quincaillerie,0,0,0,0,0,0,0,0,0,0,0,0,0,0
Industry Group / Groupe industriel:,3326,Spring and wire product manufacturing,Fabrication de ressorts et de produits en fil métallique,0,0,0,0,0,0,0,0,0,0,0,0,0,0
Industry / Industrie:,33261,Spring and wire product manufacturing,Fabrication de ressorts et de produits en fil métallique,0,0,0,0,0,0,0,0,0,0,0,0,0,0
National Industry / Industrie nationale:,332611,Spring (heavy gauge) manufacturing,Fabrication de ressorts (en métal épais),0,0,0,0,0,0,0,0,0,0,0,0,0,0
National Industry / Industrie nationale:,332619,Other fabricated wire product manufacturing,Fabrication d'autres produits en fil métallique,0,0,0,0,0,0,0,0,0,0,0,0,0,0
Industry Group / Groupe industriel:,3327,"Machine shops, turned product, and screw, nut and bolt manufacturing","Ateliers d'usinage, fabrication de produits tournés, de vis, d'écrous et de
boulons",0,0,0,0,6,1,0,0,0,0,0,0,0,7
Industry / Industrie:,33271,Machine shops,Ateliers d'usinage,0,0,0,0,6,1,0,0,0,0,0,0,0,7
National Industry / Industrie nationale:,332710,Machine shops,Ateliers d'usinage,0,0,0,0,6,1,0,0,0,0,0,0,0,7
Industry / Industrie:,33272,"Turned product and screw, nut and bolt manufacturing","Fabrication de produits tournés, de vis, d'écrous et de boulons",0,0,0,0,0,0,0,0,0,0,0,0,0,0
National Industry / Industrie nationale:,332720,"Turned product and screw, nut and bolt manufacturing","Fabrication de produits tournés, de vis, d'écrous et de boulons",0,0,0,0,0,0,0,0,0,0,0,0,0,0
Industry Group / Groupe industriel:,3328,"Coating, engraving, cold and heat treating and allied activities","Revêtement, gravure, traitement thermique et par le froid, et activités
analogues",0,0,0,0,3,0,0,0,0,0,0,0,0,3
Industry / Industrie:,33281,"Coating, engraving, cold and heat treating and allied activities","Revêtement, gravure, traitement thermique et par le froid, et activités
analogues",0,0,0,0,3,0,0,0,0,0,0,0,0,3
National Industry / Industrie nationale:,332810,"Coating, engraving, cold and heat treating and allied activities","Revêtement, gravure, traitement thermique et par le froid, et activités
analogues",0,0,0,0,3,0,0,0,0,0,0,0,0,3
Industry Group / Groupe industriel:,3329,Other fabricated metal product manufacturing,Fabrication d'autres produits métalliques,0,0,0,0,2,3,0,0,3,1,0,0,0,9
Industry / Industrie:,33291,Metal valve manufacturing,Fabrication de soupapes en métal,0,0,0,0,0,0,0,0,0,0,0,0,0,0
National Industry / Industrie nationale:,332910,Metal valve manufacturing,Fabrication de soupapes en métal,0,0,0,0,0,0,0,0,0,0,0,0,0,0
Industry / Industrie:,33299,All other fabricated metal product manufacturing,Fabrication de tous les autres produits métalliques,0,0,0,0,2,3,0,0,3,1,0,0,0,9
National Industry / Industrie nationale:,332991,Ball and roller bearing manufacturing,Fabrication de roulements à billes et à rouleaux,0,0,0,0,0,0,0,0,1,0,0,0,0,1
National Industry / Industrie nationale:,332999,All other miscellaneous fabricated metal product manufacturing,Fabrication de tous les autres produits métalliques divers,0,0,0,0,2,3,0,0,2,1,0,0,0,8
Sub Sector / Sous-secteur:,333,Machinery manufacturing,Fabrication de machines,0,0,0,1,6,9,0,0,1,2,0,0,0,19
Industry Group / Groupe industriel:,3331,"Agricultural, construction and mining machinery manufacturing","Fabrication de machines pour l'agriculture, la construction et l'extraction
minière",0,0,0,1,1,2,0,0,1,0,0,0,0,5
Industry / Industrie:,33311,Agricultural implement manufacturing,Fabrication de machines agricoles,0,0,0,0,1,0,0,0,0,0,0,0,0,1
National Industry / Industrie nationale:,333110,Agricultural implement manufacturing,Fabrication de machines agricoles,0,0,0,0,1,0,0,0,0,0,0,0,0,1
Industry / Industrie:,33312,Construction machinery manufacturing,Fabrication de machines pour la construction,0,0,0,1,0,1,0,0,1,0,0,0,0,3
National Industry / Industrie nationale:,333120,Construction machinery manufacturing,Fabrication de machines pour la construction,0,0,0,1,0,1,0,0,1,0,0,0,0,3
Industry / Industrie:,33313,Mining and oil and gas field machinery manufacturing,"Fabrication de machines pour l'extraction minière et l'exploitation pétrolière
et gazière",0,0,0,0,0,1,0,0,0,0,0,0,0,1
National Industry / Industrie nationale:,333130,Mining and oil and gas field machinery manufacturing,"Fabrication de machines pour l'extraction minière et l'exploitation pétrolière
et gazière",0,0,0,0,0,1,0,0,0,0,0,0,0,1
Industry Group / Groupe industriel:,3332,Industrial machinery manufacturing,Fabrication de machines industrielles,0,0,0,0,3,3,0,0,0,1,0,0,0,7
Industry / Industrie:,33324,Industrial machinery manufacturing,Fabrication de machines industrielles,0,0,0,0,3,3,0,0,0,1,0,0,0,7
National Industry / Industrie nationale:,333245,Sawmill and woodworking machinery manufacturing,Fabrication de machines pour les scieries et le travail du bois,0,0,0,0,0,1,0,0,0,0,0,0,0,1
National Industry / Industrie nationale:,333246,Rubber and plastics industry machinery manufacturing,Fabrication de machines pour l'industrie du caoutchouc et du plastique,0,0,0,0,0,0,0,0,0,0,0,0,0,0
National Industry / Industrie nationale:,333247,Paper industry machinery manufacturing,Fabrication de machines pour l'industrie papetière,0,0,0,0,0,0,0,0,0,0,0,0,0,0
National Industry / Industrie nationale:,333248,All other industrial machinery manufacturing,Fabrication de toutes les autres machines industrielles,0,0,0,0,3,2,0,0,0,1,0,0,0,6
Industry Group / Groupe industriel:,3333,Commercial and service industry machinery manufacturing,Fabrication de machines pour le commerce et les industries de services,0,0,0,0,1,2,0,0,0,0,0,0,0,3
Industry / Industrie:,33331,Commercial and service industry machinery manufacturing,Fabrication de machines pour le commerce et les industries de services,0,0,0,0,1,2,0,0,0,0,0,0,0,3
National Industry / Industrie nationale:,333310,Commercial and service industry machinery manufacturing,Fabrication de machines pour le commerce et les industries de services,0,0,0,0,1,2,0,0,0,0,0,0,0,3
Industry Group / Groupe industriel:,3334,"Ventilation, heating, air-conditioning and commercial refrigeration equipment
manufacturing","Fabrication d'appareils de ventilation, de chauffage, de climatisation et de
réfrigération commercia",0,0,0,0,0,1,0,0,0,0,0,0,0,1
Industry / Industrie:,33341,"Ventilation, heating, air-conditioning and commercial refrigeration equipment
manufacturing","Fabrication d'appareils de ventilation, de chauffage, de climatisation et de
réfrigération commercia",0,0,0,0,0,1,0,0,0,0,0,0,0,1
National Industry / Industrie nationale:,333413,"Industrial and commercial fan and blower and air purification equipment
manufacturing","Fabrication de ventilateurs, de soufflantes et de purificateurs d'air industriels
et commerciaux",0,0,0,0,0,0,0,0,0,0,0,0,0,0
National Industry / Industrie nationale:,333416,Heating equipment and commercial refrigeration equipment manufacturing,Fabrication d'appareils de chauffage et de réfrigération commerciale,0,0,0,0,0,1,0,0,0,0,0,0,0,1
Industry Group / Groupe industriel:,3335,Metalworking machinery manufacturing,Fabrication de machines-outils pour le travail du métal,0,0,0,0,1,1,0,0,0,1,0,0,0,3
Industry / Industrie:,33351,Metalworking machinery manufacturing,Fabrication de machines-outils pour le travail du métal,0,0,0,0,1,1,0,0,0,1,0,0,0,3
National Industry / Industrie nationale:,333511,Industrial mould manufacturing,Fabrication de moules industriels,0,0,0,0,0,0,0,0,0,0,0,0,0,0
National Industry / Industrie nationale:,333519,Other metalworking machinery manufacturing,Fabrication d'autres machines-outils pour le travail du métal,0,0,0,0,1,1,0,0,0,1,0,0,0,3
Industry Group / Groupe industriel:,3336,"Engine, turbine and power transmission equipment manufacturing","Fabrication de moteurs, de turbines et de matériel de transmission de
puissance",0,0,0,0,0,0,0,0,0,0,0,0,0,0
Industry / Industrie:,33361,"Engine, turbine and power transmission equipment manufacturing","Fabrication de moteurs, de turbines et de matériel de transmission de
puissance",0,0,0,0,0,0,0,0,0,0,0,0,0,0
National Industry / Industrie nationale:,333611,Turbine and turbine generator set unit manufacturing,Fabrication de turbines et de groupes turbogénérateurs,0,0,0,0,0,0,0,0,0,0,0,0,0,0
National Industry / Industrie nationale:,333619,Other engine and power transmission equipment manufacturing,"Fabrication d'autres moteurs et types de matériel de transmission de
puissance",0,0,0,0,0,0,0,0,0,0,0,0,0,0
Industry Group / Groupe industriel:,3339,Other general-purpose machinery manufacturing,Fabrication d'autres machines d'usage général,0,0,0,0,0,0,0,0,0,0,0,0,0,0
Industry / Industrie:,33391,Pump and compressor manufacturing,Fabrication de pompes et de compresseurs,0,0,0,0,0,0,0,0,0,0,0,0,0,0
National Industry / Industrie nationale:,333910,Pump and compressor manufacturing,Fabrication de pompes et de compresseurs,0,0,0,0,0,0,0,0,0,0,0,0,0,0
Industry / Industrie:,33392,Material handling equipment manufacturing,Fabrication de matériel de manutention,0,0,0,0,0,0,0,0,0,0,0,0,0,0
National Industry / Industrie nationale:,333920,Material handling equipment manufacturing,Fabrication de matériel de manutention,0,0,0,0,0,0,0,0,0,0,0,0,0,0
Industry / Industrie:,33399,All other general-purpose machinery manufacturing,Fabrication de toutes les autres machines d'usage général,0,0,0,0,0,0,0,0,0,0,0,0,0,0
National Industry / Industrie nationale:,333990,All other general-purpose machinery manufacturing,Fabrication de toutes les autres machines d'usage général,0,0,0,0,0,0,0,0,0,0,0,0,0,0
Sub Sector / Sous-secteur:,334,Computer and electronic product manufacturing,Fabrication de produits informatiques et électroniques,0,0,0,0,8,9,0,0,0,0,0,0,0,17
Industry Group / Groupe industriel:,3341,Computer and peripheral equipment manufacturing,Fabrication de matériel informatique et périphérique,0,0,0,0,1,1,0,0,0,0,0,0,0,2
Industry / Industrie:,33411,Computer and peripheral equipment manufacturing,Fabrication de matériel informatique et périphérique,0,0,0,0,1,1,0,0,0,0,0,0,0,2
National Industry / Industrie nationale:,334110,Computer and peripheral equipment manufacturing,Fabrication de matériel informatique et périphérique,0,0,0,0,1,1,0,0,0,0,0,0,0,2
Industry Group / Groupe industriel:,3342,Communications equipment manufacturing,Fabrication de matériel de communication,0,0,0,0,3,1,0,0,0,0,0,0,0,4
Industry / Industrie:,33421,Telephone apparatus manufacturing,Fabrication de matériel téléphonique,0,0,0,0,1,0,0,0,0,0,0,0,0,1
National Industry / Industrie nationale:,334210,Telephone apparatus manufacturing,Fabrication de matériel téléphonique,0,0,0,0,1,0,0,0,0,0,0,0,0,1
Industry / Industrie:,33422,"Radio and television broadcasting and wireless communications equipment
manufacturing","Fabrication de matériel de radiodiffusion, de télédiffusion et de
communication sans fil",0,0,0,0,1,1,0,0,0,0,0,0,0,2
National Industry / Industrie nationale:,334220,"Radio and television broadcasting and wireless communications equipment
manufacturing","Fabrication de matériel de radiodiffusion, de télédiffusion et de
communication sans fil",0,0,0,0,1,1,0,0,0,0,0,0,0,2
Industry / Industrie:,33429,Other communications equipment manufacturing,Fabrication d'autres types de matériel de communication,0,0,0,0,1,0,0,0,0,0,0,0,0,1
National Industry / Industrie nationale:,334290,Other communications equipment manufacturing,Fabrication d'autres types de matériel de communication,0,0,0,0,1,0,0,0,0,0,0,0,0,1
Industry Group / Groupe industriel:,3343,Audio and video equipment manufacturing,Fabrication de matériel audio et vidéo,0,0,0,0,1,1,0,0,0,0,0,0,0,2
Industry / Industrie:,33431,Audio and video equipment manufacturing,Fabrication de matériel audio et vidéo,0,0,0,0,1,1,0,0,0,0,0,0,0,2
National Industry / Industrie nationale:,334310,Audio and video equipment manufacturing,Fabrication de matériel audio et vidéo,0,0,0,0,1,1,0,0,0,0,0,0,0,2
Industry Group / Groupe industriel:,3344,Semiconductor and other electronic component manufacturing,Fabrication de semi-conducteurs et d'autres composants électroniques,0,0,0,0,1,1,0,0,0,0,0,0,0,2
Industry / Industrie:,33441,Semiconductor and other electronic component manufacturing,Fabrication de semi-conducteurs et d'autres composants électroniques,0,0,0,0,1,1,0,0,0,0,0,0,0,2
National Industry / Industrie nationale:,334410,Semiconductor and other electronic component manufacturing,Fabrication de semi-conducteurs et d'autres composants électroniques,0,0,0,0,1,1,0,0,0,0,0,0,0,2
Industry Group / Groupe industriel:,3345,"Navigational, measuring, medical and control instruments manufacturing","Fabrication d'instruments de navigation, de mesure et de commande et
d'instruments médicaux",0,0,0,0,2,4,0,0,0,0,0,0,0,6
Industry / Industrie:,33451,"Navigational, measuring, medical and control instruments manufacturing","Fabrication d'instruments de navigation, de mesure et de commande et
d'instruments médicaux",0,0,0,0,2,4,0,0,0,0,0,0,0,6
National Industry / Industrie nationale:,334511,Navigational and guidance instruments manufacturing,Fabrication d'instruments de navigation et de guidage,0,0,0,0,0,0,0,0,0,0,0,0,0,0
National Industry / Industrie nationale:,334512,"Measuring, medical and controlling devices manufacturing",Fabrication d'appareils de mesure et de commande et d'appareils médicaux,0,0,0,0,2,4,0,0,0,0,0,0,0,6
Industry Group / Groupe industriel:,3346,Manufacturing and reproducing magnetic and optical media,Fabrication et reproduction de supports magnétiques et optiques,0,0,0,0,0,1,0,0,0,0,0,0,0,1
Industry / Industrie:,33461,Manufacturing and reproducing magnetic and optical media,Fabrication et reproduction de supports magnétiques et optiques,0,0,0,0,0,1,0,0,0,0,0,0,0,1
